English sentence,Swahili Translation
"Jesus told us to turn the other cheek, love our enemies, and pray for them.","Yesu alituambia tuwageuzie shavu lingine, tuwapende maadui zetu, na tuwaombee."
"Whether you’re flying solo or in a relationship, I'll be thinking of you this Valentine’s Day.","Ikiwa unaruka peke yako au uko kwenye uhusiano, nitakuwa nikikufikiria Siku hi ya wapendanao."
The temperature in Boston is expected to drop to -22°C.,Halijoto mjini Boston linategemewa kushuka hadi -22C.
"If the guests don't mind, they are welcome to sleep in the basement.","Ikiwa wageni hawajali, wanakaribishwa kulala kwenye ghirofa ya chini."
Lawyers will urge the parents to take further legal action.,Wanasheria watawasihi wazazi kuchukua hatua zaidi za kisheria.
I wish to gain time.,Natarajia kupata muda.
We help each other.,Tunasaidiana.
Laughter helps ease the pain.,Kicheko husaidia kupunguza uchungu.
Big breasts in Japan are considered small by Russian standards.,Matiti makubwa huko Japan yanaonekana kuwa madogo kwa viwango vya Urusi.
I'll be there till 2:30.,Nitakuwa huko hadi 8:30 mchana
"Despite the fact that they were all Dutch people, they spoke German with each other.","Licha ya ukweli kwamba wote ni watu wa Uholanzi, walizungumziana Kijerumani."
Mental strength is crucial for success in any sports.,Nguvu za Kiakili ni muhimu sana kwa mafanikio katika michezo yoyote.
My name sounds bizarre.,Jina langu linasemeka vibaya.
What's the difference between a winner and a loser?,Kuna tofauti gani kati ya mshindi na mshindwa?
Without a goodnight kiss I won't have sweet dreams.,Bila busu ya usiku mzuri sitakuwa na ndoto tamu.
I'm sure I've seen him somewhere before.,Nina hakika nilimuona mahali fulani kabla.
It's kind of scary.,Inaogopesha kwa nama fulani.
We're not proud of it.,Hatujivunii.
Please take a moment to locate the exit closest to you.,Tafadhali chukua muda wa kutafuta njia ya kukutoa katika hili.
"Melt the chocolate, add butter and mix well.","Kuyeyusha chokoleti, ongeza siagi na changanya vizuri."
"With any luck, my cellphone battery won't die.","Kwa habati nasibu, betri ya simu yangu haiwezi kuzima."
"Life is a tragedy when seen in close-up, but a comedy in long-shot. To truly laugh, you must be able to take your pain, and play with it!","Maisha ni janga wakati yakitazamwa kwa karibu, lakini ni kichekesho kwa muda mrefu. Ili kucheka kweli, lazima uwe na uwezo wa kuchukua maumivu yako, na kuyachezea!"
"""As for the sheets, I'll hang them up myself,"" said the neighbor. ""They're awfully heavy.""","""Na kuhusu mashuka nitayaanika mwenyewe,"" alisema jirani. ""Ni mazito sana"""
This politician was accused of stealing millions of dollars in public funds.,Mwanasiasa huyu alishutumiwa kwa kuiba mamilioni ya dola katika fedha za umma.
They feed on honey and bread.,Wanakula asali na mkate.
I'm wondering what'll happen if I push this button.,Najiuliza kitatokea nini nikibonyeza hiki kifungo
"Ever since she fell in the kitchen, her mind hasn't been all there.","Tangu alipoanguka jikoni, akili yake haijawahi huko."
New Delhi is the capital of India.,New Delhi ni mji mkuu wa India.
Is that your new friend?,Huyo ni rafiki yako mpya?
"For breakfast, Sandra had a slice of bread and a cup of coffee.","Kwa kiamsha kinywa, Sandra alikuwa na kipande cha mkate na kikombe cha kahawa."
Life is hard for everybody.,Maisha ni magumu kwa kila mtu.
The old church is located in the northern part of the city.,Kanisa la zamani liko kaskazini mwa mji.
"From what you can tell, what subject would he have interest in?","Kwa maoni yako, ni mambo gani ambayo yangemvutia?"
"For my part, I don't travel to go somewhere in particular. I travel for travel's sake. The main thing is to move.","Kwa upande wangu, sisafiri kwenda mahali fulani haswa. Ninasafiri kwa sababu ya kusafiri tu. Muhimu ni kuendelea mbele."
The police weren't able to determine which one of the twins had committed the crime.,Polisi hawakuweza kuamua ni yupi kati ya mapacha aliyefanya uhalifu huo.
The prosecution could not prove which of the twins had committed the crime.,Upande wa mashtaka haukuweza kudhibitisha ni nani kati ya mapacha aliyefanya uhalifu huo.
Did I touch a raw nerve?,"Je, niliguza hali ya wasiwasi."
"Cops came with guns drawn, as I was talking to the owner on the phone.","Askari walikuja na bunduki, nilipokuwa nazungumza na mmiliki kwenye simu."
The birds were chirping happily.,Ndege walikuwa wakilia kwa furaha.
"As soon as I'm back in Shanghai, I'll cook up a delicious meal of rice noodles with crab.","Mara tu niliporudi huko Shanghai, nitapika chakula kitamu cha noodle za mchele na kaa."
"Have you ever just let the chocolate melt in your mouth? I swear, it tastes even better this way.","Umeshawahi kuwacha chokleti iyeyuke ndani ya mdomo wako? Ninaapa, ina ladha zaidi namna hii."
I thank you for your courtesy.,Asante kwa hisani yako.
A bike path collapsed in Rio.,Mpito wa baiskeli iliporomoka huko Rio.
"Do that for me, my son, delay no more, nor mention Troy again.","Unifanyie hivyo, mwanangu, usichelewe tena, wala usimtaje Troy tena."
Jesus drove the money-changers out of the temple.,Yesu aliwafukuza wabadilishaji fedha kutoka Hekaluni.
My Mercedes is bigger than yours.,Mercedes yangu ni kubwa kuliko yako.
I am a jerk and a moron who does not deserve fortune.,Mimi ni mpumbavu na mjinga asiyefaa haifaa fursa.
The judge denied me bail for no reason.,Jaji alininyima dhamana bila sababu.
There are huge snakes on this island.,Kuna nyoka wakubwa katika kisiwa hiki.
Did you fit all the clothes in the bag?,Nguo zote zilizo kwenye begi zinakutosha?
"These days, nearly every car has a GPS.","Siku hizi, karibu kila gari ina GPS."
French is not the only language that I learn.,Kifaransa sio lugha pekee ambayo ninajifunza.
What a dummy! I forgot my keys!,Ni upuuzi gani huu! Nilisahau funguo zangu!
The false alarm caused panic.,Kengele ya uwongo ilisababisha hofu.
Marie admitted that she was a prostitute.,Marie alikubali kwamba alikuwa kahaba.
"Are we gonna get some wine, dude?","Je, utapata divai, bwana?"
I found out that he was a pimp.,Niligundua kwamba alikuwa kuwadi.
Sydney is miles away from here.,Sydney ni maili mbali na hapa.
What if you did do it?,"Na je, ungefanya hivyo?"
I ask your soul and consciousness: Would life be worth living without the death penalty?,Ninauliza roho na fahamu zako: Je! Maisha yangefaa kuishi bila adhabu ya kifo?
I have extremely light skin and never tan.,Nina ngozi nyeupe sana hadi sigeuki rangi.
She asked if I need a taxi.,Aliuliza ikiwa nahitaji taksi.
"According to the tradition, Homer was blind.","Kwa mujibu wa utamaduni, Homer alikuwa kipofu."
"I built ten thousand walls, for you to knock them all down.","Nilijenga kuta elfu kumi, kwa ninyi kuiangusha yote chini."
It's dangerous to climb mountains during a storm.,Ni hatari kupanda mlima wakati wa dhoruba.
It's dangerous to climb a mountain during a storm.,Ni hatari kupanda mlima wakati wa dhoruba.
I asked him for his name.,Nikamuuliza jina lake.
I often travel between Rome and Milan.,Mimi husafiri kati ya Roma na Milan mara kwa mara.
Eve gave Adam the apple of knowledge.,Eva alimpa Adam tunda la ujuzi.
O positive is the most common blood type.,Damu ya O+ ndiyo aina maarufu zaidi.
What's making you so busy?,"Je, nini inakufanya ujishughulishe hivyo?"
I'll remain in Moscow for six days.,Nitabaki huko Moscow kwa siku sita.
She is as old as the devil's grandmother.,Yeye ni mzee kama nyanya ya shetani.
I'm not disappointed.,Nimevunjika moyo.
If only my thoughts were set into type and would come out of my mouth like a receipt.,Lau mawazo yangu yangechapishika na kutoka kinywani mwangu kama risiti.
I wish I had written it myself.,Afadhali ningeandika mwenyewe.
"I asked God for a bike, but I realized that that wasn't his method. So I stole a bike and asked God for forgiveness.","Nilimuomba Mungu baiskeli, lakini nikagundua kuwa hiyo haikuwa njia yake. Kwa hivyo niliiba baiskeli na kumwomba Mungu msamaha."
She works as an au pair in Germany.,Yeye hufanya kazi kama jakazi Ujerumani.
Are you filming?,"Je, unachukua filamu?"
"By the way, I've got to tell you something.",Ninalo jambo la kukwambia.
"""What countries are you a citizen of?"" ""I am a citizen of Turkey and Germany.""","""Je, wewe ni raia wa nchi gani?"" ""Mimi ni raia wa Uturuki na Ujerumani."""
The politician claimed that he wore neither a wig nor false teeth.,Mwanasiasa huyo alidai kuwa hakuvaa wig wala meno ya uwongo.
I got really sick of it.,Niliugua sana.
This kind of hot weather is something I'm not used to.,Aina hii ya hali ya hewa moto ni kitu ambacho sikuzoea.
I'm used to hearing sirens.,I'm used to hearing king'ora.
"A man once said to the Buddha, ""I want to be happy!"" Buddha said, ""First remove 'I', that's ego, then remove 'want', that's desire. See, now you are left with only happiness!""","Sku moja mtu mmoja alimwambia Buddha, ""Nataka kuwa na furaha!"" Buddha alisema, ""Ondoa kwanza 'mimi', hiyo ni kiburi, kisha uondoe 'unataka', hiyo ni hamu. Tazama, sasa umebaki na furaha tu! """
I don't want to be like all those who first ruin their health in search of money and then afterwards ruin themselves just to get it back.,Sitaki kuwa kama wale wote ambao kwanza huharibu afya zao kutafuta pesa halafu baadaye hujiharibu kujirejeshea afya.
Rape is always a crime of violence.,Ubakaji daima ni uhalifu wa kuvuruga.
Napoleon led his troops to Russia.,Napoleon aliongoza vikosi vyake kwenda Urusi.
Hunger is our bodies' response to having eaten less than normal.,Njaa ni mwitikio wa miili yetu kwa kuwa tumekula kidogo kuliko kawaida.
"If we’re truly a nation of family values, we wouldn’t put up with the fact that many women can’t even get a paid day off to give birth.","Kama kweli sisi ni taifa linalothamini familia, tusingevumilia ukweli wa kwamba wanawake wengi hawawezi hata kupata likizo ya uzazi."
"A ship in the harbor is safe, but that is not what ships are built for.","Meli bandarini iko salama, lakini meli hazikujengwa kwa kusudi hilo."
I would do the same thing.,Ningefanya mambo yale yale.
I needed to go for a ride.,Nahitaji kwenda kupunga hewa.
A new type of thinking is essential if mankind is to survive and move toward higher levels.,Aina mpya ya fikra ni muhimu ikiwa binadamu ataishi na kusonga mbele kwa viwango vya juu.
I've gained weight and these pants are quite tight.,Nimepata uzani na suruali hii imenishika kweli.
London voted to remain in the European Union.,London walipiga kura kubakia katika Jumuiya ya Ulaya.
I'll arrange that.,Nitaanda hilo.
"Sugar is sweet, lemon is sour... and what is bitter?","Siagi ni tamu, chungwa ni kali ... na ni nini chungu?"
Grass now grows on the path that once led to the church.,Nyasi sasa inakua kwenye njia iliyokuwa inaelekea kanisani.
I wear shorts all the time.,Huwa na valia vinyasa kila wakati.
I don't work on weekends.,Sifanyi kazi wikendi.
He laughs because the film is funny.,Anacheka kwa sababu filamu ni ya kuchekesha.
He always kisses his girlfriend goodbye when they part ways.,Huwa anamubusu mpenzi wake kwaheri wanapoachana.
The ship's captain had no schedule in particular.,Rubani wa meli hakuwa na ratiba haswa.
I'd like to see what happens.,Ningependa kuona kinachotokea.
"In the past, people went to church for confession. Nowadays they write on Facebook.","Hapo zamani, watu walikwenda kanisani ili kukiri. Siku hizi wanaandika kwenye Facebook."
Giving gifts is always nicer than receiving them.,Kutoa zawadi huwa bora zaido kuliko kuzipokea.
The eyes of Europe are fixed upon us; she demands of us a living example of freedom.,Macho ya Uropa yanatulenga; yanatutaka mfano hai wa uhuru.
No business which depends for existence on paying less than living wages to its workers has any right to continue in this country.,Hakuna biashara yoyote ambayo inategemea kulipa chini ya mshahara wa kuishi kwa wafanyikazi wake inayo haki yoyote ya kuendelea katika nchi hii.
Among us today a concentration of private power without equal in history is growing.,Kati yetu leo ​​mkusanyiko wa nguvu za kibinafsi bila usawa katika historia unakua.
Questioning received wisdom is the driving force behind progress.,Kuuliza kuhusu hekima iliyopokelewa ndiyo msingi wa maendeleo.
No one tests the depth of a river with both feet.,Hakuna mtu anayejaribu kina cha mto na miguu yote miwili.
Click on the button below to confirm your order.,Bonyeza kitufe hapa chini ili kudhibitisha agizo lako.
"Space dust may not sound very dangerous, but when even a tiny object is moving many times faster than a bullet, it can cause injury.","Vumbi huenda isiwe hatari sana, lakini wakati hata kitu kidogo kinaposonga kwa kasi nyingi kuliko risasi, inaweza kusababisha jeraha."
"Our sun will run out of energy in about five billion years. If anyone is around when it happens, they’ll have to leave Earth and find a new planet.","Jua letu litamaliza nguvu katika miaka kama bilioni tano. Mtu akiwa karibu inapotokea, watalazimika kuondoka Duniani na kupata sayari mpya."
The top few meters of the ocean store as much heat as Earth's entire atmosphere.,Mita chache za juu za bahari huhifadhi joto kama mazingira ya Dunia.
It's not like that. We're just friends.,Sio hivyo. Sisi ni marafiki tu.
Japan depends on the Arab countries for its oil supply.,Japan inategemea nchi za Uarabuni kwa usambazaji wake wa mafuta.
"Proceed strongly in the matter, but gently in the method!","Kuendelea kwa nguvu katika suala hilo, lakini kwa upole kwa namna!"
Weight is a force that is always directed toward the center of the earth.,Uzito ni nguvu ambayo huelekezwa kila wakati katikati mwa dunia.
"""Why do you hang out with those losers?"" ""They're not losers. They're my friends.""","""Kwanini unashirikiana na wapotevu wale?"" ""Wale sio wapotevu."" ""Ni marafiki zangu."""
"Fame does not bear joking, nor does the eye bear keeping faith.","Umaarufu hauna utani, wala jicho halijali imani."
I'm afraid I have no experience.,Nahofia sina tajiriba.
"Friendship is a ship big enough to carry two in fair weather, but none in foul.","Urafiki ni meli kubwa ya kutosha kubeba wawili wepesi, lakini siyo kwa wazito."
Place the bread and butter plate above the fork.,Weka sahani ya mkate na siagi juu ya uma.
I'm at a friend's house.,Nipo nyumbani kwa rafiki yangu.
Payment can be made by credit card or cash on delivery.,Malipo yanaweza kufanywa na kadi ya mkopo au pesa taslimu.
That box is heavy.,Sanduku hilo ni nzito.
Lunch is served.,Chakula kiko tayari.
Marie was the only girl to wear a skirt.,Marie alikuwa msichana wa pekee kuvaa sketi.
What has he tricked you into believing this time?,"Je, amekuhadaa kufanya nini mara hii?"
Form the dough into a ball.,Tenfeneza unga uwe mpira.
My friends wanted details.,Marafiki zangu walitaka maelezo zaidi.
Smoke was choking her.,Moshi ulikuwa ukimyonga.
The hunters got up before dawn.,Wawindaji waliamka kabla ya macheo.
Whoever hears his recorded voice has the feeling of having heard a stranger.,Yeyote anayesikia sauti yake iliyorekodiwa ana hisia za kumsikiliza mgeni.
A new railway bridge will be built between the two cities.,Daraja jipya la reli litajengwa kati ya miji hiyo miwili.
Many of the soldiers kissed their husbands goodbye.,Wanajeshi wengi waliwaaga mabwana zao kwa kuwapigia busu.
"Just as the fairy tale finished, the child had already fallen asleep.","Pindi hadithi ilipokamilika, mtoto alikuwa amekwisha lala."
She's being questioned by our sketch artist.,Anahojiwa na mchoraji wetu.
She's just a babe in the woods.,Yeye ni mtoto matatani.
This fruit is better than that one!,Matunda haya ni bora kuliko lile!
We were in a state of incredible weakness.,Tulikuwa katika hali ya udhaifu wa ajabu.
"As of now, I refuse to get involved with any sort of drama. It's very childish and annoying to say the least.","Kama ilivyo sasa, nakataa kuhusika na aina yoyote ya sarakasi. Ni ya kitoto sana na inasikitisha kabisa."
The instructions are on the package.,Maagizo yako kwenye kifurushi.
My mom yells at me all the time for no reason.,Mama alinipigia kelele wakati huo bila sababu.
The security situation on the border became explosive this weekend.,Hali ya usalama kwenye mpaka ililipuka wikendi hii.
Kind of Blue is Miles Davis' most famous album.,Aina ya Bluu ni Albamu maarufu zaidi kwa Miles Davis.
"I fear that the ghost exists. It has been well known for three centuries, since 1584 in fact, and always makes its appearance before the death of any member of our family.","Ninaogopa kuwa mizimu ipi. Imejulikana sana kwa karne tatu, tangu 1584 kwa kweli, na kila wakati huonekana kabla ya kifo cha mtu yeyote wa familia yetu."
What'll we call it?,Tutauita nini?
The passengers are waiting.,Wasafiri wanangojea.
Society does not encourage relationships between people who have a large age gap.,Jamii hahimili uhusiano kati ya watu ambao wana tofauti kubwa la umri.
There is no middle ground between these two options.,Hakuna eneo la kati baina ya chaguzi hizi mbili.
"In a first-past-the-post voting system, many votes are wasted.","Katika mfumo wa upigaji kura wa kwanza-wa-kura, kura nyingi huharibika."
Students are required to perform one hour of community service per week.,Wanafunzi wanahitajika kufanya huduma ya jamii kwa saa moja kila wiki
He could see the entire landscape from the top of the mountain.,Angeweza kuona mazingira yote kutoka juu ya mlima.
More information on the system structure is available in the Features section.,Habari zaidi juu ya muundo wa mfumo inapatikana katika sehemu ya Sifa.
The Black Death wiped out at least one third of Europe's population between 1348 and 1350.,Kifo cha watu weusi kilifuta angalau theluthi moja ya idadi ya watu wa Ulaya kati ya 1348 na 1350.
We have a lot of homework.,Tuna kazi nyingi za shule.
The population of the village dropped by a third.,Idadi ya watu wa kijiji hicho ilishuka kwa theluthi.
"If that woman will love me for who I am for a lifetime, I would marry her.","Ikiwa mwanamke huyo atanipenda nilivyo maishani, nitamuoa."
The highest wisdom is that of the heart.,Hekima hutoka moyoni.
I have basic reading knowledge of Italian and Swedish.,Nina maarifa ya msingi ya kusoma ya Italia na Uswidi.
I have some advice for you.,Nina ushauri kwako.
You wouldn't like it.,Hutaipenda.
We'll get there eventually.,Mwishowe tutafika hapo.
We've all got to do better.,Sisi sote tunauwezo wa kufanya bora.
I applied to the school for the lab assistant position.,Nilituma maombi ya nafasi ya msaidizi wa maabara shuleni.
We're going there alone.,Tunaenda huko pekee yetu.
This bank secretly opened bank accounts in people's names without their permission.,Benki hii ilifungua akaunti za benki kwa siri kwa majina ya watu bila idhini yao.
You're much smarter than I am.,Wewe ni mwerevu kuniliko.
That is not what they are going to talk about.,Hill si jambo watakalozungumzia.
I don't like being around poor people.,Sipendi kuwa karibu na watu masikini.
Hopefully this Punch & Judy show is nearly over.,Natumai kuwa onyesho hili la Punch & Judy limekaribia kukamilika.
The two most powerful warriors are patience and time.,Mashujaa wawili wenye nguvu zaidi ni uvumilivu na wakati.
Can I have a one-day ticket?,Naweza kupata tiketi ya Siku moja?
"Come on now, stop whimpering all the time, let's go somewhere for a change of mood.","Njoo sasa, acha kuwaza wakati wote, wacha tuende mahali kwa badiliko la mhemko."
I didn't understand what he wanted to tell me.,Sikuelewa kuwa alitaka kuniambia.
There aren't any books in French in the library.,Hakuna vitabu vyovyote vya Kifaransa maktabani.
The tide destroyed the sand castle.,Mawimbi yaliharibu ngome ya mchanga.
"He's a cracking bloke, he is.",Yeye ni mwanume mzuri.
No man has a good enough memory to be a successful liar.,Hakuna mwanye kumbukumbu nzuri ya kuwa mwongo.
You get used to anything.,Unazoea kila kitu.
Hopefully she doesn't grow up to be a maniac like the rest of her family.,Natumaini yeye asikue na kuwa kichaa kama familia yake.
Coffee with lots of sugar and milk passes for a real meal.,Kahawa iliyo na sukari nyingi na maziwa ni kama chakula kamili.
I live in a small village fifty kilometers from the Polish capital.,Ninaishi katika kijiji kidogo kilomita hamsini kutoka mji mkuu wa Kipolishi.
I got here Monday night.,Niliwasili hapa Jumatatu usiku.
I'd really rather not know.,Afadhali nisijue kamwe.
She's a drag king.,Yeye ni mfalme wa kuvuruta.
"In 1973, oil cost three dollars per barrel; in 2008 - 80 dollars per barrel.","Mnamo 1973, mafuta yaligharimu dola tatu kwa pipa; mnamo 2008 - dola 80 kwa pipa."
There is a curious crowd on both sides of the avenue.,Kuna umati unaovutia pande zote mbili za barabara.
"Don't dig a pit for somebody to fall into, or you will end up in it yourself.","Usichimbe shimo ili mtu aanguke, au utauangukia mwenyewe."
Some people are born on third base and go through life thinking they hit a triple.,Watu wengine wamezaliwa katika utajiri na wanapitia maisha wakidhania wamepata sifa kupitia mafanikio yao.
I couldn't do anything about it.,Singeweza kufanya chochote.
"The newspaper said that a lion escaped from the zoo, and that it could now be in any part of the city.","Gazeti lilisema kwamba simba alitoroka kutoka kwa mbuga, na kwamba sasa anaweza kuwa katika sehemu yoyote ya jiji."
"For each person there is a sentence—a series of words—which has the power to destroy him. Another sentence exists, another series of words, which will heal the person.","Kwa kila mtu kuna sentensi-msururu wa maneno - ambayo ina nguvu ya kumuangamiza. Sentensi nyingine ipo, msururu mwingine wa maneno, ambayo yatamponya mtu."
"""I'll give you twenty bucks for it."" ""Nothing doing. Thirty dollars; take it or leave it."" ""Fine, then I guess I'll take my business elsewhere.""","""Nitakupa tembo ishirini kwa hiyo."" ""Hakuna kinachofanya. Dola thelathini; kuchua au uwache."" ""Shwari, basi nadhani nitafanya biashara yangu mahali pengine."""
Can we talk now?,Tunaweza kuzungumza sasa?
I just found out my favorite hotel has gone out of business.,Nimegundua tu kuwa mkahawa wangu niupendao umefunga biashara.
We haven't fixed the final details of the budget.,Hatujaandaa maelezo ya mwisho ya bajeti.
Merry Christmas to you and your family.,Nakutakia wewe na familia yako Krismasi njema.
"Soon, in the great theatre, the lights will be put out, and the empty stage will be left to ghosts.","Hivi karibuni, katika ukumbi mkubwa wa michezo, taa zitazimwa, na ukumbi mtupu utaachwa mizuka."
The most important part of an open-door policy is that employees feel welcome to approach their boss with any issue that concerns them.,Sehemu muhimu zaidi ya sera ya uwazi ni kwamba wafanyakazi wanahisi kuwa na ruhusa ya kumuendea mkubwa wao na suala lolote linalohusu.
I've been waiting for that to happen.,Nimekuwa nasubiri hilo litendeke.
I hardly ever see this kind of thing anymore.,Sio rahisi kwangu kuona kitu kama hiki.
He would rather play video games than be with me sexually.,Anaradhi acheze michezo ya video kuliko kufanya mapenzi na mimi.
"If you deposit your letter at the front post after 7 PM, it'll be delivered the following day.","Ikiwa barua yako kwa posta ya mbele baada ya saa 1:00 jioni, itapelekwa siku inayofuata."
"In this era of post-truth politics, it's easy to cherry-pick data and come to whatever conclusion you desire.","Katika enzi hii ya siasa za baada ya ukweli, ni rahisi kuchagua data na kufikia hitimisho yoyote unayotaka."
"During the wedding rehearsal, he was almost too nervous to speak.","Wakati wa mazoezi ya harusi, alikuwa na wasiwasi mwingi."
My husband's situation is different.,Hali ya mume wangu ni tofauti.
Healthy competition is always good.,Ushindani wa afya daima ni mzuri.
A special prosecutor was appointed.,Mwendesha mashtaka maalum aliteuliwa.
Yelling is completely unnecessary.,Kugomba sio lazima kabisa
Knee replacement is major surgery.,Kugeuzwa kwa goti ni upasuaji mkubwa.
It's a beautifully designed boat.,Ni mashua iliyoundwa vizuri.
Thousands of kids were adopted.,Maelefu ya watoto waliasiliwa.
There's a place for everybody.,Kuna mahali kwa kila mtu.
The firing pin's been removed.,Pini ya kufyatua imeondolewa.
The chopper made a loud noise.,Helikopta ilifanya kelele kubwa.
We're still working that out.,Bado tunafanya kazi hiyo.
The potential market is huge.,Soko linalowezekana ni kubwa.
The main lobby appears empty.,Mapokezini makuu yanaonekana kuwa tupu.
I intend to be first in line.,Ninakusudia kuwa wa kwanza mu mstari.
We're working on this issue.,Tunajitahidi kusuluhisha shida hii.
Wait until the dust clears.,Subiri hadi vumbi iishe.
Their gang color is purple.,Rangi yao ya genge ni ya zambarau.
Let's see how it plays out.,Wacha tuone jinsi itakavyotokea.
The timing is unfortunate.,Ni bahati mbaya muda hautoshi.
The television is blaring.,Runinga ina sauti ya juu.
That's how we were raised.,Hivyo ndivyo tulilelewa.
Murphy's law states that whatever can go wrong will go wrong.,Sheria ya Murphy inasema kwamba chochote kinachoweza kwenda vibaya kitaenda vibaya.
The airport remains open.,Uwanja wa ndege ulibaki waki
Does anyone read anymore?,Kunaye anayendelea kusoma?
Birth records are public.,Rekodi za kuzaliwa ni kwa watu wote
I suck at relationships.,Sina sifa nzuri katika mahusiano.
I didn't try to respond.,Sikujaribu kujibu.
I didn't train properly.,Sikupata mafunzo kikamilifu.
Lives are being lost.,Maisha yanapotea.
"Die, scum!","Kamilika, maji machafu!"
They began chanting.,Walianza kughani.
Some bills can wait.,Bili zingine zinaweza kunagojea.
Send me photos.,Nitumie picha.
Nightmares are a sign of health issues.,Ndoto mbaya ni dalili ya matatizo ya kiafya.
My cousin has a large collection of action figures.,Binamu yangu ana mkusanyiko mkubwa wa takwimu za vitendo.
"Medical error is the third leading cause of death in the US, after heart disease and cancer.","Kosa la kimatibabu ni sababu ya tatu ya kusababisha kifo huko Amerika, baada ya ugonjwa wa moyo na saratani."
Do they know about each other?,"Je, wanafahamiana?"
