English sentence,Swahili Translation
"I think that you wanted to add a translation of the sentence where you posted a comment. To translate a sentence, just click on this button.","Nadhani ulitaka kuongeza tafsiri ya sentensi mahali ulipoweka maoni. Kutafsiri sentensi, bonyeza tu kitufe hiki."
"Beware of he who would deny you access to information, for in his heart he dreams himself your master.","Uwe mwangalifu na mtu ambaye atakuzuia kupata taarifa, kwa sababu moyoni mwake anajiona ni bwana mkubwa wako."
I can't tell him apart from his brother.,Siwezi kumwambia yeye isipokuwa ndugu yake
"During First Contact, the alien visitors would not show themselves physically.",Wakati wa Maingiliano ya Kwanza wageni hawakujionyesha kwa mwili.
The terrorists swore vengeance on that country.,Magaidi hao waliapa kulipiza kisasi kwa nchi hiyo.
You decide on what to do.,Unaamua utakachofanya.
"While at first he got famous from an independent film that he made, he then went from the director of a musical TV series to a full-fledged movie director. Such was his career.","Wakati mwanzoni alipata umaarufu kutoka filamu huru ambayo aliunda, kisha akaenda kutoka kwa mkurugenzi wa safu ya runinga ya muziki hadi kwa mkurugenzi wa sinema kamili. Hivyo ndivyo kazi yake ilikuwa."
We all need to learn to deal with this situation.,Sote tunahitaji kujifunza kushughulikia hali hii.
The principal's democracy made him popular among teachers and students.,Demokrasia ya Mkuu wa chuo ilimfanya awe maarufu kati ya waalimu na wanafunzi.
I eat fish every week.,Nala samaki kila wiki.
The Bible is clearly a complex piece of writing that could not possibly have been written by a single author.,Kwa kweli Bibilia ni maandishi magumu ambayo haingeweza kuandikwa na mwandishi mmoja.
"I don't have much interest in sports games like soccer or baseball, but I do like seeing weird or outstanding plays in them.","Sina hamu kubwa na michezo kama mpira wa miguu au mpira wa vijiti, lakini napenda kuona michezo ya kusisimua au ya muhimu ndani yao."
"""Superman"" is showing at the movie theater this month.","""Superman"" itaonyeshwa kwenye ukumbi wa sinema mwezi huu."
The judge asked the jury to reach a verdict.,Jaji aliomba Baraza la mahakama kutoa maamuzi.
This summer the transfer market will be more exciting than ever.,Msimu huu soko la kuhamisha litakuwa la kufurahisha zaidi kuliko hapo awali.
Is it comfortable to travel by ship?,Unaweza kusafiri kwa raha kwa njia ya meli?
I'll move the solar panel from the balcony to the roof in due course.,Nitaihamisha seliumeme ya jua kutoka kwenye roshani hadi paani kwa muda mfupi.
"In peace, sons bury their fathers. In war, fathers bury their sons.","Kwa amani, wana huzika baba zao. Kwa vita, baba huzika wana wao."
The press conference is scheduled to begin one hour from now.,Mkutano wa waandishi wa habari umepangwa kuanza saa moja kutoka sasa.
"I feel your pain, buddy.","Nahisi maumivu yako, rafiki."
The racket slipped from my hands and broke itself on the court when I made the serve.,Racket hiyo ilianguka kutoka mikononi mwangu na kujigonga kwenye koti nilipokuwa natoa huduma hiyo.
"To suppose justice to do this, is to destroy the principle of its existence, which is the thing itself.","Kufikiria haki ya kufanya hivyo, ni kuharibu kanuni ya uwepo wake, ambayo ndiyo muhimu."
Our team won 3 to 1.,Timu yetu ilishinda 3 kwa 1.
"""You got a smoke?"" ""Yeah, but I don't have a lighter.""","""Una sigara?"" ""Ndio, lakini sina kiberiti."""
If he got a 10 out of 10 on the test it's because he cheated.,Angepata 10 juu ya 10 katika mjarabu ni kwa sababu alidanganya.
Is it really possible?,"Je, inawezekena kweli?"
Vampires must drink blood to survive.,"Ili wanyonya-damu waweze kuishi, ni lazima wanywe damu."
Only 514 people have been in space.,Ni watu 514 ambao wamezuru angani.
Only high officials had access to the President.,Ni maafisa wakuu walioweza kumfikia Rais.
"We all have our time machines. Some take us back, they're called memories. Some take us forward, they are called dreams.","Sote tuna mashine zetu za wakati. Zingine huturudisha nyuma, zinaitwa kumbukumbu. Zingine hutupeleka mbele, zinatwa ndoto."
Everyone was doing it.,Kila mtu alikuwa akifanya hivyo.
"My dad doesn't want me driving there everyday, so he's paying my rent.","Baba yangu hataki nifike huko kila siku, kwa hivyo analipa kodi yangu."
The government tortured the citizen to make him confess.,Serikali ilimtesa mwananchi ili kumfanya akiri.
We recommend cutting off all further contact with the rebels.,Tunapendekeza kukata mawasiliano zaidi na waasi.
Julia gives a kiss to her daughter.,Julia anambusu binti yake.
I bought five metres of fabric in the shop.,Nilinunua kitambaa cha mita tano kwenye duka.
She's hiding the truth from us.,Anatuficha ukweli.
Ding is playing on the computer.,Dinga anacheza kwa tarakilishi.
"Suicide is an act of revenge against yourself, and I personally have nothing against myself.","Kujiua ni kitendo cha kulipiza kisasi dhidi yako mwenyewe, na mimi binafsi sina chochote dhidi yangu."
The source made reference to Kate and the Queen being seen chatting and smiling together last March.,Chanzo hicho kilirejelea Kate na Malkia wakionekana kuzungumza na kutabasamu pamoja Machi iliyopita.
The African elephant has bigger ears than the Asian elephant.,Tembo wa Kiafrika ana masikio makubwa kuliko tembo wa Asia.
"I won't stake my reputation on it, but I think it's a genuine alien life form.","Sitaweka sifa yangu juu yake, lakini nadhani ni aina halisi ya maisha ya mgeni."
"Opera in English is, in the main, just about as sensible as baseball in Italian.","Opera kwa Kiingereza ni, kwa ukuu, sawa na busara kama mchezo wa besiboli kwa Kiitalia."
Venus is only slightly smaller than the Earth and Mars is bigger than half of Earth.,Venus ni kidogo kuliko Dunia na Mars ni kubwa kuliko nusu ya Dunia.
The profit from drugs they used for buying lots of real estate.,Faida kutoka kwa dawa walizotumia kununua majumba mengi.
We still have to turn the hay and chop wood.,Bado tunapaswa kugeuza nyasi na kukata kuni.
The buzzing of the bees makes me a little nervous.,Kulia kwa nyuki kunanifanya kuwa na wasiwasi kidogo.
Cows are large and their horns are long; sheep are small and their horns are short.,"Ng'ombe ni wakubwa na pembe zao ni ndefu, kondoo ni wadogo na pembe zao ni fupi."
It hasn't been done before.,Haijafanyika hapo awali.
"Humans have five senses: sight, hearing, touch, taste and smell.","Wanadamu wana hisi tano: kuona, kusikia, kugusa, kuonja na kunusa."
Further testing is required.,Upimaji zaidi inahitajika.
Are you going to record today's episode?,"Je, utarekodi kipindi cha leo?"
Howdy folks.,Mambo jamaa.
You've got to try this.,Ni vizuri ujaribu hili.
My friend who lives in England will come to Brazil next week and will stay five months expecting to get a good job here.,Marafiki zangu wanaoishi Uingereza watakuja Brazil wiki ijayo na watakaa kwa miezi mitano wakitegemea kupata kazi nzuri hapa.
We told the man we could and would make such a scandal out of this as should make his name stink from one end of London to the other.,Tulimwambia mtu huyo tunaweza na tungefanya kashfa kama hii kwa sababu inapaswa kufanya jina lake livume kutola upande mmoja wa London kwenda upande mwingine.
"This is Nina, your granddaughter.","Huyu ni Nina, mjukuu wako."
Don't curse or I'll wash your mouth out with soap.,Usilaaniwe au nitaosha kinywa chako kwa sabuni.
The association counts thirty members.,Shirika lina wati thelathini.
Let's relax a little.,Tutulie kidogo.
"The path to evil may bring great power, but not loyalty.","Njia ya uovu inaweza kuleta mamlaka makubwa, lakini sio uaminifu."
"In for a penny, in for a pound.",Ukiamua kufanya biashara usiogope hasara.
"You must kneel at my feet, kiss my hand and swear that I am an angel.","Lazima upigie magoti miguuni mwangu, kuubusu mkono wangu na kuapa kwamba mimi ni malaika."
"God gave you a penis and a brain, but only enough blood to run one at a time.","Mungu alikupa uume na ubongo, lakini damu ya kutosha tu kuendesha moja kwa wakati mmoja."
Our true hope is that there exists life in other worlds.,Tumaini ltu la kweli ni kwamba kuna maisha katika baada ya kifo.
He would prefer to live in a developing country because of the exchange rate.,Angependelea kuishi katika nchi inayoendelea kwa sababu ya kiwango cha kubadilisha fedha.
Fashion is a vicious cycle.,Mtindo ni mzunguko mbaya.
The boy grabbed his sister by the legs and dragged her all over the room until she admitted defeat.,Mvulana akamshika dada yake kwa miguu na kumvuta karibu na chumba hadi akakubali kushindwa.
Parents should monitor their children's activities.,Wazazi wanapaswa kufuatilia shughuli za watoto wao.
We were hoping something interesting would happen.,Tulikuwa unatarajia jambo la kufurahisha litafanyika.
"With a hammer and nails in her hand, she headed straight here.","Akiwa na nyundo na msumari mkononi mwake, akaelekea hapa moja kwa moja."
She threw off her shoes and socks in anger.,Alivua viatu na soksi na kuvitupa kwa hasira.
I am filling this bottle with oil.,Ninajaza chupa hii kwa mafuta.
He's wanted for grand theft auto.,Anatafutwa kwa wezi mkubwa wa magari.
Teach me how to play a reed pipe.,Nifundishe jinsi ya kupiga filimbi ya utete.
She wants the most bang for her buck.,Anataka kishindo kikuu kwa mume wake.
The Queen of England is related to the King of Sweden.,Malkia wa Uingereza anahusiana na Mfalme wa Uswidi.
Anyone who respects someone who respects the current president of the United States is not respected by at least one person.,Yeyote anayeheshimu mtu anayeheshimu rais wa sasa wa Amerika haheshimiwi na mtu angalau mmoja.
The former president of the United States is the only American who knows the president of every country.,Rais wa zamani wa Amerika ndiye Mmarekani pekee anayemjua rais wa kila nchi.
Rebecca has at least two daughters.,Rebecca ana binti angalau wawili.
You're not born evil; you learn how to be evil.,Hukuzaliwa shetani; unajifunza kuwa shetani.
I don't want to be your secret.,Sitaki kuwa msiri wako.
"When operating the unit, play in a well-lit room and keep a safe distance from the screen.","Unapofanyakazi kwenye kizio, cheza kwenye chumba chenye mwanga mzuri na ukae mbali na kioo."
"Now, as a test of courage, won't you go into that abandoned building over there? It's famous as a place haunted by spirits.","Sasa, kama jaribio la ujasiri, utaenda kwenye jengo lililotengwa hapo? Mahali panapopagawa na mapepo ni maarufu."
The students held the male student down and cut his hair with a pair of scissors.,Wanafunzi walimshikilia mwanafunzi wakiume chini na kukata nywele zake kwa mkasi.
"Yesterday I put the gifts in the attic, today I put them under the bed and tomorrow I'll throw them out the window.","Jana niliweka zawadi kwenye darini, leo nimeziweka chini ya kitanda na kesho nitazitupa nje ya dirisha."
I'm the ghost of a sad poet who died a terrifying death.,Mimi ni kizimu cha mshairi mwenye huzuni aliyekufa kifo cha kuogofya.
The ground started to shake and the alarm rang.,Ardhi ilianza kutikisika na kengele ikalia.
Thank you for burning my shirt with your cigarette.,Asante kwa kuchoma shati langu kwa sigara yako.
Have you found an answer to this question?,Umepata jibu kwa swali hili?
I was used to eating like a pig.,Nilikuwa nimezoea kula kama nguruwe.
Will you not lose your mind?,"Je, hutapoteza kumbukumbu zako?"
Prince Charles will be the next British king.,Mwanamfale Charles atakuwa mfalme ajaye Uingereza.
It's a chick thing.,Ni jambo la wasichana.
I bring my children to the park almost every day.,Nawaleta watoto wangu bustani karibu kila siku.
"When a medical doctor follows the coffin of a patient, it is in fact sometimes the cause that follows the effect.","Wakati daktari akifuata jeneza la mgonjwa, kwa kweli ni wakati mwingine sababu inayofuata athari."
"We mustn't burn our forest, because it is the source of the oxygen we breathe.","Hatupaswi kuchoma msitu wetu, kwa sababu ndio chanzo cha oksijeni tunayopumua."
The foot contains an ankle and five toes with nails.,Mguu una kiunga na vidole vitano vyenye kucha.
I am eating with my bro.,Ninakula na kaka yangu.
Our headquarters are located in another part of town.,Makao yetu makuu yako katika sehemu nyingine ya mji.
I like chess.,Napenda mchezo wa chess.
Auto-destruct sequence armed.,Mfuatano wa uharibifu wa kiotamatiki umejihami na silaha.
I went as far as Germany but I didn't have time to visit Alexander.,Nilienda hadi Ujerumani lakini sikuwa na wakati wa kumtembelea Alexander.
He was voted prom king.,Alipigiwa kura ya Ufalme.
I must be getting tired. I feel sleepy as soon as I finish eating supper.,Nitakuwa nimechoka. Nitalala mapema tu baada ya kumaliza kula chakula cha jioni.
A ship of dreams landed in a nightmare.,Meli ya ndoto ilitua kwa ndoto mbaya.
I recommend you visit the Imperial War Museum in London.,Ninapendekeza utembelee Makumbusho ya Vita vya Imperial huko London.
The history of the relationship between the Catholic Church and the Jews was not always a happy or an easy one. Too often it was written in tears.,Historia ya uhusiano kati ya Kanisa Katoliki na Wayahudi haukuwa wa kufurahisha au rahisi. Mara nyingi iliandikwa kwa machozi.
"Our liberty depends on the freedom of the press, and that cannot be limited without being lost.","Uhuru wetu unategemea uhuru wa waandishi wa habari, na huo hauiwezi kupunguzwa bila kupotea."
How long do you need to learn German?,Je! unahitaji muda upi kujifunza Kijerumani?
"You ate an apple, yay!","Ulikula tufaha, yay!"
I bet Uncle Alfred'll come back.,Natabiri Mjomba Alfred atarudi.
"Children begin by loving their parents; after a time they judge them; rarely, if ever, do they forgive them.",Watoto huanza kwa kuwapenda wazazi wao; baada ya muda wanaowahukumu; wakitaka huwawasamehe mara chache.
The seeds of evil deeds are evil thoughts.,Mbegu za matendo maovu ni mawazo mabaya.
I wanted to share with you a new application that I'm using to create a memory book for my grandfather who recently passed away.,Nilitaka kushiriki nawe programu mpya ambayo ninatumia kuunda kitabu cha kumbukumbu kwa babu yangu mkubwa aliyeaga hivi majuzi.
"It isn't because I don't want you to laugh at me, rather it is because I'd like to laugh at you.","Sio ati sitaki mnicheke, bali ni kwa sababu napenda kukuchekelea."
"Now that same-sex marriage is legal, I'm one step closer to marrying myself.","Sasa hiyo ndoa ya jinsia moja ni halali, nimebakisha hatua moja kujioa mwenyewe."
They train you to act before thinking. Just execute orders.,Wanakufundisha kutenda kabla ya kufikiria. Toa maagizo tu.
Elite soldiers are almost always selected among the special forces.,Wanajeshi hodari karibu siku zote huchaguliwa kati ya vikosi maalum.
I want to change the world.,Nataka kubadilisha dunia.
"Ladies and gentlemen, thank you very much indeed.","Mabibi na mabwana, asanteni sana kwa dhati."
"If I change my name in order to avoid racist comments, then why don't I change the color of my skin as well?","Ikiwa ninabadilisha jina langu ili niepuke maoni ya ubaguzi wa kirangi, kwa nini pia nisibadilishe rangi ya ngozi yangu?"
How many nuclear bombs does the United Kingdom have?,Uingereza ina mabomu mangapi ya nyuklia?
How many cars can this garage hold?,Ni magari mangapi gereji hii inaweza kuchukua?
Are they free on Friday afternoon?,"Je, utakuwa huru Ijumaa alasiri?"
They call her Lena.,Wanamuita Lena.
How much does it cost to eat at such a place?,Inagharimu hela ngapi kula mahali kama hapo?
How do we do that?,Tunafanyaje hivyo?
Sharks eat fish.,Papa ana kula samaki
I'm hitting the road.,Ninaanza safari.
I missed you so much.,Nilikukosa sana.
I've never told anyone that before.,Sijawahi kuambia mtu hilo hapo mbeleni.
"Suddenly a man appeared, packed my suitcase and ran away.","Ghafla mtu akatokea, akapakia bagi langu na kukimbia."
Can I know where you work?,"Je, naweza jua unakofanya kazi?"
How long do you have to eat lunch?,Unataka kula chakula cha mchana kwa muda gani?
Do you think fried chicken should be eaten with a fork or with your fingers?,"Je, unafikiri kuku wa kukaanga inapaswa kuliwa na uma au na vidole vyako?"
Get out of my face.,Ondoka usoni mwangu.
The fat girl is eating too much sweets with lots of sugar.,Huyo msichana mnene anakula vitu vitamu sana vyenye sukari nyingi.
Don't kid yourself. You couldn't afford to buy a house like this.,Usijipumbaze. Hungweza kununua nyumba kama hii.
Just follow my lead.,Uni fuate tu.
"I've just arrived at the top of a mountain. That's really surprising, because according to my map, there should be a lake here.","Nimefika tu kilele cha mlima. Hiyo inashangaza sana, kwa sababu kulingana na ramani yangu, kunapaswa kuwa na ziwa hapa."
One day you'll understand.,Siku moja utaelewa.
The temperature fell to five degrees below zero.,Joto lilishuka hadi nyuzi tano chini ya sifuri.
You can't ask him to do that.,Huwezi kumwambia afanye hivyo.
She's obsessed with the Harry Potter books.,Anapenda sana vitabu vya Harry Potter.
How many did you get?,Ulipata ngapi?
I can't do this.,Siwezi kufanya hivi.
She lied to me.,Alinidanganya.
We traveled through the whole land.,Tulisafiri nchi nzima.
He's old enough to go to school.,Ana umri wa kutosha kwenda shule.
We've known each other for a long time.,Tumejuana kwa muda mrefu.
You're acting like a child.,Unafanya mambo kama mtoto.
You must face your fears.,Lazima ukabiliane na woga wako.
What surprises me is that they can actually sell that product for so much money.,Kinachonishangaza ni kwamba wanaweza kuuza bidhaa hiyo kwa pesa nyingi.
Education is important.,Elimu ni muhimu.
She's only a couple of years older than me.,Ana umri mdogo tu kunizidi.
He had but one desire: to shrink away and live among the lights and shadows.,Alikuwa na hamu moja tu: kufinyika na kuishi kati ya taa na vivuli.
"During the entire lesson, he counted flies.","Wakati wa somo lote, alihesabu nzi."
The lion roars.,Simba ananguruma.
"Honor! truly a very convenient coin, which those who know how to pass it may lay out with great advantage.","Kuenzi! kweli sarafu inayofaa sana, ambayo wale wanaojua kuipitisha wanaweza kupata na faida kubwa."
The company issued a press release.,Kampuni ilitoa taarifa kwa waandishi wa habari.
We've taken a long hard look at your sales-directed communication and decided to buy some of the weed that you smoke.,Tumechukua muda mrefu kutazama mawasiliano yako ya moja kwa moja kwa mauzo na tukaamua baadhi ya bangi unazovuta.
Harry put on his robe and wizard hat.,Harry alivaa vazi lake na kofia ya kichawi.
I've been trying to hack my way into the system.,Ninajaribu kuingilia mawasiliano ya mfumo huu.
We ate some turtle soup.,Tulikula supu ya bata.
Please wait a minute.,Tafadhali subiri kidogo.
"""Do you think that Russia and America can become friends?"" — ""Yes, certainly! I'm absolutely sure. Whatever may happen, our most important friend will be America in any case, but whether South or North America - that depends on you.""","""Je, unafikiri Russia na Amerika wanaweza kuwa marafiki?"" — ""Ndio, kwa hakika! Nina uhakika kamili. Chochote kinachoweza kufanyika, rafiki yetu muhimu zaidi ni Amerika kwa hali yoyote, lakini iwe Amerika ya Kaskazini au Kusini - hiyo inakutegemea."""
I can't come right now.,Siwezi kuja sasa hivi.
We can't keep on fooling ourselves.,Hatuwezi kuendelea kudanganyana.
Feel the rhythm and follow the beat.,Sikiliza rithimu na ufuate mdundo.
They can't see me.,Hawawezi kuniona.
I can't think about anything else.,Siwezi kufikiria chochote.
Where do you get a haircut?,Unapata wapi kukata nywele?
I thought you guys had already left.,Nilifikiri mlikuwa mshaondoka.
"If a porter carries your luggage, don't forget to tip him.","Ikiwa hamali amebeba mzigo wako, basi usisahau kumuongoza."
The All-Russian Public Opinion Research Center measures Russian citizens' trust in politicians every week.,Kituo cha Utafiti cha Maoni ya Umma cha Urusi hutathmini imani ya raia wa Urusi kwa wanasiasa kila wiki.
In this store they like to bait and switch.,Katika duka hili wanapenda kuweka na kubadili.
He was never what the verdict of society calls drunk. Yet was he ever sober?,"Hakuwa mlevi kama wanajamii wanavyochukulia. Je, aliwahi kuwa shwari?"
A statement against social program cuts has been read.,Taarifa kuhusu kupunguzwa kwa mpango wa kijamii imesomwa.
"She was put in charge of the project, despite having zero leadership skills.","Aliwekwa katika usimamizi wa mradi huo, licha ya kukosa ujuzi katika uongozi."
"Those who are terrorists for some, are freedom fighters for others.","Wale ambao ni magaidi kwa wengine, ni wapigania uhuru kwa wengine."
He had a change of heart.,Alikuwa na mbadiliko moyoni.
This is but a humble downtown store.,Hii ni duka la chini la jiji.
"If the idiots would compete, you would be second because you are too idiot to be the first.","Ikiwa wakaidi wangekamilisha, ungekuwa wa pili kwa sababu wewe ni mkaidi sana kuwa wa kwanza."
I'm not sure where I should put this.,Sina uhakika pahali pa kuweka hili.
"Just the gesture is enough, thank you.","Ishara tu, inatosha, Asante."
Is this valuable?,"Je,hii ni ya thamani?"
I want to start a family.,Nataka kuanza familia.
I want us to be together.,Nataka tuwe pamoja.
I just want people to like me.,Nataka watu wanipendee.
We're resting naked in the warm sand.,Tunajilaza uchi kwa mchanga wenye joto.
Do you want me to tell the police?,"Je, ungependa niwaeleze polisi?"
I want to lodge a formal complaint.,Nataka kuweka malalamiko rasmi.
"I've been a member of this organization for five years. Oh wait, no. Six.","Nimekuwa mwanachama wa shirika hili kwa miaka mitano. Ah ngoja, hapana. Sita"
Do you want to come back to my office?,"Je, unataka kurudi ofisini mwangu?"
"They leave you, not so dark as the waiting house, not so surely promised to eternity as that which every night becomes the climbing stars.","Wanakuacha, sio giza sana kama nyumba ya kusubiria, bila hakika kama ahadi ya umilele kama ile ambayo kila usiku inakuwa nyota za kupandia."
"In Japan, people legally become adults at the age of twenty.","Huko Japan, watu hupata hadhi ya utu uzima kihalali, wakifikisha umri wa miaka ishirini."
Relations between China and Japan have been tense recently.,Mahusiano kati ya Uchina na Japan yamekuwa mabaya hivi karibuni.
I want to make sure there is enough.,Nataka kuhakikisha kuwa inatosha.
Let's save the environment!,Tuhifadhi mazingira!
"We are poor, but we are happy.","Tu masikini, lakini tunafuraha."
"Practice is tough. But, if it is for the sake of victory, then you must be able to endure.","Mazoezi ni magumu Lakini, ni kwasababu ya ushindi, basi inakulazimu ustahimili."
The grand prize is a kiss from the princess.,Zawadi kubwa ni busu kutoka kwa binti mfalme.
There's a famous book in English whose entire last chapter is a single sentence.,Kuna kitabu maarufu katika Kiingereza ambacho sura yake mwisho ni sentensi moja tu.
The Ministry of Environment would play a more important role that way.,Wizara ya Mazingira ingekuwa na jukumu muhimu zaidi kwa njia hiyo.
He entered the lion's den.,Aliingia katika pango la simba.
We are busy men.,Sisi tuna shughuli nyingi.
For my own part I wish the Bald Eagle had not been chosen the Representative of our Country.,Kwa upande wangu mwenyewe ningefurahi ikiwa Bald Eagle hangekuwa amechaguliwa Mwakilishi wa nchi yetu.
The secret is killing you.,Siri ni kukuuwa.
I heard that Mr. Collins asked you to marry him.,Nilisikia kuwa Mr Collins alikuomba akuoe.
You're awful at keeping secrets.,Wewe ni mbaya katika kutunza siri.
On the main menu of this DVD there is no 'Play Main Feature' button.,Kwenye menyu kuu ya DVD hii hakuna kitufe cha 'Play Main Feature'.
"For a bribe, a traffic policeman agreed not to take away a driver's license.","Kwa kuhongwa, polisi wa trafiki alikubali kutompokonya dereva mmoja leseni yake."
"It's poor form to spit from the window into the street, or into the fire, or anywhere people might step on what you have spit.","Ni vibaya kutema mate kutoka dirishani kwenda barabarani, au motoni, au popote watu wanapoweza kukanyaga ulichotema."
"According to the newspaper, she committed suicide.","Kulingana na gazeti hili, alijiua."
She showed me around.,Alifahamisha kila mahali.
Do something about that noise.,Fanya kitu juu ya kelele hiyo.
I have to take care of something.,Lazima nishughulikie kitu.
We must stop this dangerous plague.,Ni lazima tuzuie pigo hili ni hatari.
It is painful for me to see the name of the traitor among other names in the same sentence.,Ni chungu kwangu kuona jina la msaliti kati ya majina mengine katika sentensi moja.
The English Channel is the divide between Britain and Europe.,Kiingereza ndicho kinachotofautisha Uingereza na Ulaya.
Make sure the brain is engaged before putting the mouth in gear.,Hakikisha ubongo unafanya kazi kabla ya kuzungumza.
My tooth is giving me unbelievable pain.,Jino langu linanipa maumivu makali.
The members of the family had grave doubts regarding the explanation they received from the army.,Wanafamilia walikuwa na mashaka makubwa kuhusu maelezo waliyoyapata kutoka kwa jeshi.
We're serious.,Hatufanyi mzaa.
"The Latin language is not entirely unknown to me, but I altogether lack the ability to speak it.","Lugha ya Kilatini haijanipotelea kabisa kwangu, lakini kabisa sina uwezo wa kuizungumza."
I buy loads of stuff at that store.,Nanunua bidhaa nyingi katika duka lile.
I hate his talking big on every occasion.,Nachukua kuongea mengi kwake kila wakati.
He loves ritual.,Anapenda tambiko.
Mona is still running a temperature and should stay at home.,Mona ana joto jingi na anapaswa kukaa nyumbani.
"Most people who have lived in a foreign country have experienced some form of culture shock, although many people don't recognize it in themselves.","Watu wengi ambao wameishi katika nchi ya nje wamepata mshtuko wa kitamaduni wa aina fulani, ingawa watu wengi hawatambui."
I had never seen it.,Sikuwa nimeiona.
