English sentence,Swahili Translation
"Whoever the representative is from their division, treat him well.","Yeyote anayewakilisha kutoka kwa kitengo chao, mshughulikie vizuri."
"College students should study hard, but equally they should also make time for an active social life.","Wanafunzi wa vyuo vikuu wanapaswa kusoma kwa bidii, lakini pia kwa usawa wanapaswa kupata wakati wa maisha ya kijamii."
The president shall be selected by majority vote.,Rais atachaguliwa kwa kura ya wengi.
The huge waves upset their boat.,Mawimbi makubwa yanasumbua mashua yao.
I got a big pay raise.,Nilipata nyongeza mkubwa wa mshahara.
Tall trees catch much wind.,Miti mirefu hushika upepo mwingi.
"The entire theater turned to chaos when somebody cried ""Fire!"".","Thieta yote iligeuka mtu alipolia ""Moto!""."
Two of my books have been taken.,Viwili kati ya vitabu vyangu vimechukuliwa.
I hope that some scientist will soon discover a cure for AIDS.,Natumai kuwa mwanasayansi fulani atagundua tiba ya UKIMWI hivi karibuni.
No one called my attention to it.,Hakuna aliyeshighulikia swala langu.
"On warm days, bears stretch out or lie on their backs with their feet in the air.","Katika siku za joto, wazazi hutawilisha au hulalia migongo yao na miguu yao huweka hewani."
Each boy student has a school badge on his cap.,Kila mwanafunzi wa kiume ana beji ya shule kwenye kofia yake.
It is true of American society that the male is the head of the household.,"Ni kweli kwamba katika jamii ya Marekani, mume ndiye mkubwa wa nyumba."
The men are smiling on cue.,Wanaume wanatabasamu wanapozinduliwa.
There is a shopping district underground.,Kuna eneo la ununuzi kwenye ghorofa ya chini.
The tourists as well as local people come to the square for shopping.,Watalii na pia watu wa eneo hilo huja kwenye mraba kwa ununuzi.
Hours lost on the ground cancel out the advantage of speed in the air.,Masaa yaliyopotezwa kwenye ardhi yanawiana na faida ya kasi hewani.
"Indicate size, color, and style on the order form.","Onyesha ukubwa, rangi na mtindo kwa fomu ya kuagiza."
"The long cruel winter at last came to an end, giving place to a gentle warm spring.","Msimu mrefu wa baridi kali mwishoni ulikamilika, na msimu wa chemchemi ukaja na joto."
The pain shoots into my right leg.,Maumivu yananidunga kwa mguu wangu wa kulia.
You can go out and play as long as you stay in the yard.,Unaweza kwenda nje na kucheza maadamu hutoki nje ya ua.
The hostile army began to attack.,Jeshi adui lilianza kushambulia.
The Emperor prayed for the souls of the deceased.,Kaisari aliombea roho za waliofariki.
"On the way out I said to my waitress, ""Be careful, Sue. There's something funny about the glasses you gave me - they're filled in on the top, and there's a hole on the bottom!""","Nikiwa njiani kutoka nikamwambia mhudumu wangu, ""Kuwa mwangalifu, Sue. Kuna kitu cha kuchekesha kuhusu glasi ulionipa - zimejazwa juu, na kuna shimo chini! """
"By tradition, people play practical jokes on 1 April.","Kama mazoea, watu hufanya utani tarehe 1 Aprili."
The invention of the telephone caused a revolution in our way of living.,Uvumbuzi wa simu ulisababisha mapinduzi katika njia yetu ya kuishi.
I wish people would stop throwing away empty cans and other trash along the path up the mountain.,Natamani watu wangeacha kutupa mikebe mitupu na takataka zingine njiani kwenda mlimani.
The angry crowd threw missiles at the police.,Umati wenye hasira uliwatupia makombora polisi.
We're running short of fuel for the winter.,Tutakosa mafuta kwa msimu wa baridi.
Ice covers the lake during the winter.,Barafu hufunika ziwa wakati wa msimu wa baridi.
Tokyo is surrounded by many satellite cities.,Tokyo imezungukwa na miji mingi ya satelaiti.
The authorities have been hiding the facts from the public.,Mamlaka yamekuwa yakificha ukweli kutoka kwa umma.
Television sets began to appear house by house at that time.,Runinga zilianza kuonekana nyumba kwa nyumba wakati huo.
We sell goods on commission.,Tunauza bidhaa kwa mafao.
"Having a cracking headache, I went to bed earlier than usual.","Kuumwa sana na kichwa, kulifanya niende kulala mapema zaidi."
With the world turning circles running round my brain.,Pamoja na ulimwengu kugeuza mizunguko kuzunguka ubongo wangu.
Animal bodies are made up of cells.,Miili ya wanyama imeundwa na seli.
You can't be at two places at once.,Hauwezi kuwa katika sehemu mbili mara moja.
The company has decided to sell some of its money-losing units.,Kampuni imeamua kuuza baadhi ya vitengo vyake vinavyoleta hasara.
I will mentally return to childhood and do it all over again.,Nitarudi kiakili utotoni na kuifanya tena.
"Losing the way, he chose the road at random.","Alipopoteza njia, alichagua barabara kwa bahati nasibu."
Special services include a personal driver for each guest.,Huduma maalum inajumuisha dereva wa kibinafsi kwa kila mgeni.
Persons with special skills can easily get jobs.,Watu walio na stadi maalum wanaweza kupata kazi kwa urahisi.
"Except in special circumstances, anyone is allowed to enter the building.","Isipokuwa katika hali maalum, mtu yeyote anaruhusiwa kuingia ndani ya jengo."
By special arrangement we were allowed to enter the building.,Tuliruhusiwa kuingia ndani ya jengo hilo kwa mpangilio maalum.
Take any books that you want to read.,Chagua vitabu vyovyoye unavihitaji kusoma.
"When suddenly faced with a dangerous situation, hold your horses - make sure of the proper action, then act.","Ukikabiliwa na hali ya hatari kwa ghafla, kaa kimya - hakikisha hatua sahihi, kisha chukua hatua."
"All of a sudden, the door shut with a bang.","Ghafla, mlango ulifungwa kwa mpigo."
A sudden crack of thunder broke his sleep.,Mlio mkubwa wa radi ulimtoa usingizini.
"In the Southern region, sales were up 47 percent.","Katika kanda ya Kusini, mauzo yalikuwa asilimia 47."
The nun prayed and crossed herself.,Mtawa aliomba kisha akafanya ishara ya msalaba.
"Flesh gives birth to flesh, Spirit gives birth to Spirit.","Mwili huzaa mwili, Roho huzaa Roho."
Japan's foreign direct investment reached $10 billion last year.,Uwekezaji wa moja kwa moja wa kigeni wa Japan ulifikia dola bilioni 10 mwaka jana.
Japan's money power has a global reach now.,Nguvu ya pesa ya Japan ina ufikiaji wa ulimwengu sasa.
Japan is expected to play a greater role in international society.,Japan inatarajiwa kuchukua jukumu kubwa katika jamii ya kimataifa.
Japan stood with the United States at the U. N. Assembly.,Japan ilisimama na Merika katika Mkutano wa U. N.
Japan must depend on foreign trade to make ends meet.,Japan lazima itegemee biashara ya nje kujipatia mapato.
Japan needed contact with the Western countries.,Japan ilihitaji mawasiliano na nchi za Magharibi.
Japan depends on foreign countries for oil.,Japan inategemea nchi za kigeni kwa mafuta.
Japan achieved a remarkable development in industrial technology after the war.,Japan ilipata maendeleo makubwa katika teknolojia ya viwanda baada ya vita.
"One of the important differences between Japanese and Americans is that Japanese tend to choose a safe course in life, while Americans choose to explore and challenge life.","Tofauti mojawapo kati ya Wajapani na Wamarekani ni kwamba Wajapani huchagua njia salama maishani, huku Wamarekani huchagua kupambana na changamoto za maisha."
The Japanese tend to identify themselves with the group they belong to.,Wajapani hujitambulisha na kundi ambalo wao ni wanachama.
"When the cat's away, the mice do play.","Wakati paka ni mbali, panya hucheza."
Writing new year's cards is a Japanese institution.,Kuandika kadi za mwaka mpya ni desturi ya Kijapani.
"While a brain operation is being performed, both doctors and nurses must handle the patient with kid gloves and yet with all speed practical.","Wakati wa kufanya upasuaji wa ubongo, madaktari na wauguzi lazima wamhudumie mgongwa wakiwa na glavu ingawa kwa haraka inayowezekana."
Wide is the gate and broad is the way that leads to destruction.,Mlango mpana na mkubwa ni njia ambayo huelekea kwenye maangamizo.
"As I checked your delivery that I received, I found it included a T-shirt which I did not order.","Nilipotazama mzigo ulionilitea, niligundua kuna fulana ambayo sikuagiza."
The judge was exhausted from the nervous strain.,Jaji alikuwa amechoka kutokana na tatizo la neva.
The criminal robbed the landlord of a hundred thousand dollars and ran away.,Mhalifu alimuibia mpangishaji nyumba dola mia elfu kisha akakimbia.
Isn't he gorgeous? - So tall and smart-looking.,"Je, yeye si mtanashati? Ni mrefu sana na ana mwonekano mzuri."
"He is Mr Brown, chairman of the committee.","Yeye ni Bwana Bown, mwenyekiti wa kamati."
What was his motive for setting the house on fire?,Kusudi lake lilikuwa nini kuwasha moto kwenye nyumba?
"The moment he touched it, it blew up.","Wakati alipoiguza, ilipasuka."
He can't have solved it.,Hangeweza kutatua.
I'll wait here till he comes back.,Nitamsubiri mpaka arudi.
It never occurred to me that he might insist on treating me to dinner.,Haijawahi kunitokea kwamba anaweza kusisitiza kuninunulia chajio.
"He writes a daily journal, and that inspired me to try doing the same thing, but in English.","Anaandika shajara, na hiyo imenitia moyo kujaribu kufanya hivyo, lakini kwa Kiingereza."
He has no sympathy for single parent families.,Hana huruma kwa familia za mzazi mmoja.
I would be grateful if you could give him some information on local conditions.,Ningefurahi ikiwa unaweza kumpa habari kadhaa kuhusu hali za kawaida.
His alibi is above suspicion.,Dai lake limezidi tuhuma.
Such conduct on his part gave rise to her parents' suspicion.,Tabia kama hiyo upande wake ilisababisha tuhuma za wazazi wake.
His behavior is always honorable.,Tabia yake ni ya kuheshimika siku zote.
His recovery was nothing short of a miracle.,"Kupona kwake, kulikuwa kwa miujiza sana."
His technique was unique and absolutely amazing.,Mbinu yake ilikuwa ya kipekee na ya kushangaza mno.
He turned to a tall woman nearby.,Alimgeukia mwanamke mrefu aliyekaribu.
Some board members questioned his ability to run the corporation.,Baadhi ya wanachama wa tume walihoji uwezo wake wa kuendesha shirika hilo.
His absence gave birth to all sorts of rumors.,Kukosa kwake kulileta uvumi mwingi.
His latest novel marks a great advance on his previous ones.,Riwaya yake ya hivi karibuni inaashiria maendeleo makubwa kwa zile za awali.
His latest works are on display at the city hall. They are fabulous beyond description.,Kazi zake mpya zimeonyeshwa katika ukumbi wa halmashauri ya Jiji. Ni wazuri sana kupita maelezo.
I would have failed but for his help.,"Laiti singepata usaidizi wake, singefaulu."
I wonder if his tax returns will stand close examination.,Nashangaa ikiwa malipo yake ya ushuru yatastahimili uchunguzi.
"Sailing a boat, his chief hobby, costs him most of his salary.","Kuendesha mashua, kazi anayoipenda, inamgharimu mshahara wake."
I think his suggestion is worth considering.,Nafikiri pendekezo lake linafaa kuzingatiwa.
His discovery gave rise to a revolution in transport.,Ugunduzi wake ulileta mapinduzi katika uchukuzi.
The way he spoke attracted the attention of a famous writer.,Namna alivyoongea ilivutia makini ya mwandishi mashuhuri.
He is the man who I believe can help you.,Yeye ni MTU ambaye ninaamini anaweza kunisaidia.
He divided one million dollars among his five sons.,Aligawanya dola milioni moja kati ya wanawe watano.
They were born one month apart in 1970.,Walizaliwa mwaka 1970 wakipishana mwezi moja.
He reached home shortly before five o'clock.,Alifika nyumbani muda mfupi kabla ya saa kumi na moja jioni.
"He ate chicken, along with salad and rolls.","Alikula kuku, saladi pamoja na vikuto."
He got tired soon.,Alichoka karibuni.
He refused to accept such an absurd proposal.,Alikataa kukubali pendekezo kama hilo la upuuzi.
He denied having taken part in the crime.,Alikana kwamba kushiriki kwenye uhalifu huo.
He gave the poor woman some bread and a five dollar bill besides.,Alimpa yule mwanamke maskini mkate na noti ya dola tano.
He hid behind the tree.,Akajificha nyuma ya mti.
He is a tennis player.,Yeye ni mchezaji wa tenisi.
He gave an account of how he had escaped.,Alitoa taarifa ya jinsi alivyonusurika.
"When he entered the building, he was frightened by a sudden cry.","Alipoingia ndani ya jengo hilo, alishtushwa na kilio cha ghafla."
He made a fortune by writing a best selling novel.,Alipata pesa kwa kuandika riwaya bora ya kuuza.
He explained the process of building a boat.,Alifafanua mchakato wa ujenzi wa mashua.
He kicked the ball out of the ground.,Alitupa mpira nje ya uwanja.
He is nothing but a child.,Yeye ni mtoto tu.
He was within an ace of success.,Alikuwa katika ukamilifu wa mafanikio.
He put his finger on the cause of the rocket's failure to orbit.,Alinyooshea kidole sababu ya roketi kushindwa kufuata obiti.
He keeps a diary in English.,Huwa anahifadhi shajara kwa Kiingereza.
He took a pencil in his hand.,Alishika penseli kwenye mkono wake.
He sometimes loses his temper for nothing.,Wakati mwingine yeye hukasirika bure.
He walked about the streets.,Alitembea kwenye mitaa.
He connected the cord to the machine.,Aliunganisha waya ya umeme kwa mashine.
I wonder if he can lend me his guitar during the vacation.,Nashangaa kama anaweza kunikopesha gita lake wakati wa likizo.
He put his foot on the brake suddenly.,Alishika breki mguu mtupu kwa ghafla.
He wasted his time on gambling at the horse races.,Alipoteza wakati wake kwa kamari kwenye mbio za farasi.
I am sure he would be the last person to do it.,Ninahakika atakuwa mtu wa mwisho kukifanya.
He wishes to resign on the grounds that his health is failing.,Anatamani kujiuzulu kwa sababu kwamba afya yake inadhoofika.
He did it as he had been told.,Alifanya kama alivyoambiwa.
He had the good fortune to be rescued from the burning building.,Alikuwa na bahati nzuri ya kuokolewa kutoka kwa jengo lililokuwa linawaka moto.
He will assist us in changing the tire.,Atatisaidia kubadilisha tairi.
He asked me if I knew his father.,Aliniuliza ikiwa ninamjua baba yake.
"He said he would write to me, but he hasn't.","Alisema ataniandikia, lakini bado hajafanya hivyo."
He took offense at what I said and turned on his heels.,Mambo niliyosema yalimkasirisha na akaondoka ghafla.
He is no relation to me.,Hana uhusiano nami.
He sent an immediate reply to my telegram.,Alituma jibu la haraka kwenye telegramu yangu.
He is concerned about the result of the exam.,Ana wasiwasi kuhusu matokeo ya mtihani.
He drew a check for twenty thousand yen in favor of his wife.,Aliandika cheki kwa yen elfu ishirini kwa mkewe.
He was sent into combat.,Alipelekwa vitani.
He was holding a large box in his arms.,Amebeba sanduku kubwa mkononi.
He turns off the lights so as not to waste electricity.,Yeye huzima taa ili wasiharibu umeme.
He cleaned out his saving on betting.,Alitumia akiba yake yote kwa kamari.
He is possessed of a strong fighting instinct.,Anatawaliwa na silika kubwa ya mapigano.
He owed his success to both ability and industry.,Mafanikio yake yalitokana na uwezo na bidii.
He drove a nail into the board.,Aligongelea msumari kwenye bodi.
He decided to play it safe and pull out of the tournament due to his injured knee.,Aliamua kucheza kwa usalama na kujitoa katika mashindano baada ya kuumia goti.
He built hospitals and helped the people of Africa improve their lives.,Alijenga mahosipitali na alisaidia watu wa Afrika kuboresha maisha yao.
He broke the law.,Alivunja sheria
He left on an expedition to the North Pole.,Aliondoka kwa safari ya kwenda North Pole.
"As he grew up, he learned to put things in perspective.","Wakati wa kukuwa, alijifunza kuweka vitu kwa mtazamo."
They had only one child.,Walikuwa na mtoto mmoja tu.
Their bags were checked by security guards at the gate.,Mifuko yao ilikaguliwa na walinzi getini.
Their manner of bringing up their children is extremely unusual.,Jinsi wanavyolea watoto wao sio kawaida kabisa.
They developed a special computer system and fixed it to his wheelchair.,Waliandaa mfumo maalum wa kompyuta na kuisimamisha kwa kiti chake cha magurudumu.
They sat in the front row of the concert hall and heard the orchestra clearly.,Walikaa mstari wa mbele wa ukumbi wa tamasha na walisikia okestra vizuri.
They attempted in vain to bribe the witness.,Walijaribu kutoa rushwa kwa shahidi huyo
They sent me a sample in answer to my request.,Walinitumia sampuli katika kujibu ombi langu.
They all account Mr James an able businessman.,Wote wanathibitisha Bwana James kuwa mwanabiashara mwenye uwezo.
They experienced emotional pain and despair.,Walipata maumivu ya kihisia na kukata tamaa.
There is a strong bond of affection between them.,Kuna uhusiano mkubwa wa kimapenzi kati yao.
They shot down two enemy planes during the raid.,Walipiga risasi ndege mbili za adui wakati wa uvamizi.
They earn their living by collecting and selling old newspapers.,Wanapata pesa za kujikimu kwa kukusanya na kuuza magazeti ya zamani.
They went on a voyage.,Wamesafiri.
They believe their country is secure against foreign enemies.,Wanaamini kuwa nchi yao iko salama dhidi ya maadui wa kigeni.
They are in the teachers' room.,Wamo chumbani mwa mwalimu.
They had better have kept their mouths shut.,Ingekuwa bora kama wangenyamaza.
"They mentioned two famous tourist spots, neither of which we have visited yet.",Walitaja maeneo mawili maarufu ya watalii ambayo hatujawahi kuyatembelea.
I received a letter from her to the effect that she couldn't accept my marriage proposal.,Nilipokea barua kutoka kwake ikionyesha kwamba hakuweza kukubali ombi langu la ndoa.
I could hear her sobbing in her bedroom.,Nilimsikia akipiga kelele chumbani mwake.
"As soon as she entered the room, I rose to my feet and made a deep bow.","Mara tu alipoingia chumbani, niliinuka na kuinama."
The man whom she is talking with is Mr Allen.,Mwanamume ambaye anaongea naye ni Bwana Allen.
Singing comes as naturally to her as flying does to birds.,Kuimba huja kwa kawaida kwake kama vile kuruka kwa ndege.
I remember meeting her somewhere.,Nakumbuka kukutana naye mahali fulani.
Her folks cannot help worrying about her wound.,Wazazi wake hawawezi jizuia kuhofia kidonda chake.
Her voice still rings in my ears.,Sauti yake bado ipo masikioni mwangu.
Her beauty cast a spell over him.,Urembo wake ulimletea mapepo.
Her father works at the bank.,Babake anafanya kazi kwenye benki.
I can't make head nor tail of her lecture on health and physical education.,Sikuelewa kamwe hotuba yake kuhusu afya na elimu ya mwili.
Her name was Agnes then.,Jina lake lilikuwa Agnes wakati huo.
"Instead of giving Alex a nut each time he said something, she'd only give it when he specifically said ""nut.""","Badala ya kumpa Alex njugu kila wakati akisema kitu, angetoa tu akisema ""njugu."""
She set a new Japanese record in the 100 meter dash.,Aliweka rekodi mpya ya Kijapani kwenye dashi ya mita 100.
She will be back in less than ten minutes.,Atarudi chini ya dakika kumi.
"She made a tour of America, stopping in six cities.","Alifanya ziara ya Amerika, huku akisimama katika miji sita."
She got her coat and hat on.,Alikuwa amevalia koti na kofia yake.
She has been on a diet for the past two months because she put on too much weight during the winter.,Amekuwa muangalifu kwa mlo kwa miezi miwili iliyopita kwa sababu aliongeza uzito sana wakati wa msimu wa baridi.
She took first prize in the race.,Alichukua tuzo ya kwanza katika mbio.
She owns a Turner.,Anamiliki mkereza.
She is looking for her missing wallet.,Anatafuta mkoba wake ambao imepotea.
She is panting from playing basketball.,Anajitolea kucheza mpira wa kikapu.
She screams if you even touch her funny bone.,Anapiga mayowe hata ukimgusa mfupa wake wa kuchekesha.
She beat off a big snake with a plastic toy bat.,Alipiga nyoka mkubwa na paka ya toy ya plastiki.
She admitted to having heroin.,Alikubali kuwahi kuvuta mihandarati.
She takes pleasure in seeing horror films.,Anafurahia kutazama filamu za kutisha.
She went out of her way to do such a foolish thing.,Alifanya kitendo hiki cha kijinga kimakusudi.
She says she will call you later.,Anasema atakupigia baadaye.
She was dropped from the height of happiness into the depth of misery.,Alitoka kwenye furaha nyingi hadi kwenye huzuni ya kukithiri.
She wore a diamond ring on her left third finger.,Alivaa pete ya almasi kwenye kidole chake cha tatu cha kushoto.
She lived next door to us.,Aliishi karibu nasi.
She means more than my life to me.,Anamaanisha zaidi ya maisha yangu kwangu.
She has an automatic washing machine.,Ana mashine moja kwa moja ya kuosha.
She is capable of handling the circumstances.,Ana uwezo wa kushughulikia hali hizo.
She slowly developed hatred toward me.,Polepole akanichukia.
"Besides attending the funeral, she needs to make all the arrangements.","Mbali na kuhudhuria mazishi, anahitaji kufanya mipango yote."
She was studying drama on a special scholarship.,Alikuwa anasomea mchezo wa kuigiza kupitia ufadhili maalum.
She stopped smoking on account of health concerns for her pregnancy.,Aliacha kuvuta sigara kwa sababu ya afya yake wakati wa ujauzito.
She was eager to feed the birds.,Alikuwa na hamu ya kuwalisha ndege.
She filed a suit for divorce against him.,Alifungua kesi ya talaka dhidi yake.
She is proud of being beautiful.,Anajivunia kuwa mrembo.
She usually sleeps for eight hours.,Kawaida yeye hulala kwa masaa nane.
She was filled with deep grief to hear of her father's sudden death.,Alijawa na huzuni kubwa kusikia juu ya kifo cha ghafla cha baba yake.
She was educated in the United States.,Alipata elimu nchini Marekani.
She came running with her eyes shining.,Alikuja akikimbia huku macho yaking'aa.
They shot the film in an actual desert.,Walichukua filamu kwenye jangwa halisi.
They held a special session on trade problems.,Walifanya kikao maalumu juu ya shida za kibiashara.
The secretary asked that I hold the line until Mr Williams was free to take my call.,Katibu aliomba nisubiri hadi Bwana Williams awe huru kuchukua simu yangu.
Small hills look flat from an airplane.,Milima ndogo hukaa tambarare kutoka kwa ndege.
I have no objection to paying a special fee if it is necessary.,Sina pingamizi kulipia ada maalum ikiwa itanilazimu.
Her courage during her illness is an inspiration to us all.,Ujasiri wake wakati wa ugonjwa wake unaleta matumaini kwetu sote.
"Poverty is a pain, but no disgrace.","Umasikini ni mchungu, lakini hauonewi haya."
It was unfortunate that he lost his passport.,Ni bahati mbaya alipoteza pasipoti yake.
A good husband makes a good wife.,Mume mzuri hufanya mke mzuri.
Daddy loves to say funny things.,Baba anapenda kusema vitu vya kuchekesha.
Father would often read detective stories in his spare time.,Baba alikuwa anasoma hadithi za kijasusi kwa wakati wake wa mapumziko.
My father has given up smoking recently.,Babangu ameacha uvutaji wa sigara hivi majuzi.
My father sat reading the evening paper.,Babangu aliketi akisoma gazeti la jioni.
Physics is the basic physical science.,Fizikia ni sayansi ya kimsingi ya mwili.
The soldiers got to the foot of the hill before dawn.,Maaskari walifika chini ya kilima kabla ya mawio.
She got her feet wet teaching while she was in the Peace Corps.,Alisimama wakati akiwa kwenye Peace Corps.
Throughout the United State large numbers of young people enter college every year.,Amerika nzima idadi kubwa ya vijana huingia vyuo vikuu kila mwaka.
I watched television during a break in my studies.,Nilitazama runinga wakati wa likizo ya masomo yangu.
The sheriff beat the suspect until he was almost dead.,Liwali alimpiga mtuhumiwa hadi alikaribia kufa.
Her mother knocked on the door.,Mama yake alimbishia mlango.
Throw a stick and watch the dog fetch it.,Tupa fimbo na utazame mbwa akiileta.
Stay where you are until I give you a sign.,Bakia ulipo hadi nikupe ishara.
I saw a marvelous animal act at the circus.,Niliona kitendo cha ajabu cha wanyama kwenye sarakasi.
"I went down to the sports office to sign up for the last position on the basketball team, but somebody else beat me to it.","Nilienda kwa ofisi ya michezo kusaini nafasi ya mwisho kwenye timu ya mpira wa magongo, lakini mtu mwingine alinishinda."
I have a good many things to do today.,Nina mambo mengi ya kufanya leo.
I was not being taught to experiment or even to repeat experiments.,Sikuwa ninafunzwa kujaribu au hata kuregelea majaribio.
I'd like to engage in foreign trade in the future.,"Ningependa kushiriki katika biashara ya kigeni, siku za usoni."
We saw Mac make a fantastic shot.,Tuliona Mac akifanya jaribio zuri.
The queen of the witches is dead.,Malkia wa wachawi ameuawa.
Every Tuesday her fat little fingers flew like birds up and down the keys of song too.,Kila Jumanne vidole vyake vyenye vinene viliruka kama ndege juu na chini kwa mapigo ya wimbo pia.
It's no good making the same old products year after year.,Si vizuri kutokeza bidhaa ile ile mwaka baada ya mwaka.
"If something were wrong with my car, I'd go by bus.","Ikiwa kitu kilikuwa kibaya kwa gari langu, ningeenda kwa basi."
"Unable to prove his innocence, he was forced to leave his native town.","Kwa kuwa hakuweza kuthibitisha kutokuwa na hatia, alilazimika kuondoka mji wake wa kuzaliwa."
I'd like to make a tour of famous sites in London tomorrow.,Ningependa kufanya ziara ya tovuti maarufu huko London kesho.
A house built of wood is more easily burnt than a house of stone.,Nyumba iliyojengwa kwa mbao huchomeka kwa urahisi zaidi kuliko nyumba ya jiwe.
"There were times, at falling night, when he looked up with curiosity to the stars.","Kuna nyakati, usiku ukicha, alipotazama nyota juu, kwa udadisi."
It's only when I can't sleep at night that the ticking of the clock becomes loud enough to bother me.,Ni wakati tu nashindwa kulala usiku ambapo mlio wa saa unazidi na kunisumbua.
The fields lay covered with deep snow.,Mashamba yalifunikwa na theluji nzito.
The savage robbed me of my precious jewels and ran away.,Katili huyo aliniibia vito vyangu vya thamani na kukimbia.
