English sentence,Swahili Translation
Are you sure?,"Je, una uhakika?"
I love you.,Nakupenda.
This is my friend Rachel. We went to high school together.,Huyu ni rafiki yangu Rachel. Tulikwenda pamoja shule ya sekondari.
I have a headache.,Kichwa kinauma.
"Where there's a will, there's a way.","Penye nia, pana njia."
I don't want to go to school.,Sitaki kwenda shule.
Don't forget about us!,Hutusahau!
How much is it?,Ni bei gani?
Can you keep a secret?,"Je, unaweza kutunza siri?"
What are you doing?,Unafanya nini?
What are you doing?,Mnafanya nini?
You have many books.,Una vitabu vingi.
You have many books.,Mna vitabu vingi.
You are teachers.,Nyinyi ni waalimu.
Do you remember?,Unakumbuka?
How is your family?,Habari za nyumbani?
What's new?,Habari gani?
I'd like to rent a car.,Ningependa kukodi gari.
Have a nice day.,Siku nzuri.
"If he had stayed at home that day, he would not have met with disaster.","Kama angekaa nyumbani, asingepata taabu."
"If I had known it, I would have gone there.","Kama ningejua, ningekwenda."
Take a taxi to the hotel.,Kwenda kwa teksi hotelini.
What is the language spoken in Brazil?,Lugha ambayo inasemwa Brazil ni nini?
What?,Nini?
I don't have a ticket.,Sina tikiti.
Don't forget to post the letter.,Usisahau kupeleka barua
Would you like another cup of coffee?,"Je, ungependa kikombe kingine cha kahawa?"
Our cat is in the kitchen.,Paka yetu ipo jikoni.
I come from England.,Natoka Uingereza.
It looks like a duck.,Anafanana bata.
Are you studying?,"Je, unasoma?"
Do you speak Japanese?,"Je, wasema Kijapani?"
How are you? What sort of day are you having today?,"Hujambo, bwana? Habari gani za mchana?"
All of us stared at her.,Wote tuliangalia saa yake.
We are students.,Sisi ni wanafunzi.
I have a telephone in my room.,Nina simu katika chumba changu.
I am an American.,Mimi ni Mmarekani.
I come from Australia.,Ninatoka Australia.
I have a computer.,Nina kompyuta.
I come from Brazil.,Ninatoka Brazil.
I have an old bicycle.,Nina baiskeli ya zamani.
I come from Saitama.,Ninatoka Saitama.
I am a teacher.,Mimi ni mwalimu.
Who am I?,Mimi ni nani?
I want to live.,Nataka kuishi.
I'll come back.,Nitarudi.
Do good to those who hate you.,Watendeeni mema wanaowachukia.
God created the world.,Mungu aliumba dunia.
Someone knocked on the door.,Mtu alibisha mlango.
Turn off the light.,Zima taa.
I come from Japan.,Ninatoka Japani.
He comes from England.,Anatoka Uingereza.
He is eating.,Anakula.
She comes from California.,Anatoka California.
I don't know.,Sijui.
Who are you?,Wewe ni nani?
Who are you?,Nyinyi ni nani?
You are my friend.,Wewe ni rafiki yangu.
I have a dog.,Nina mbwa.
How are you today?,Habari za leo?
How are you today?,Habari za mchana?
She hated him.,Alimchukia.
She didn't like him.,Hakumpenda.
Are you at home?,"Je, wewe ni nyumbani?"
What's your name?,Jina lako nani?
Are you hungry?,"Je, una njaa?"
Are you hungry?,"Je, mna njaa?"
He is teaching Arabic.,Anafundisha Kiarabu.
"Could I have the bill, please?","Naweza kupata bili, tafadhali?"
How is the family?,Hamjambo nyumbani?
Love is blind.,Mahaba ni tongo.
I go to school.,Naenda shule.
Don't worry.,Hakuna matata.
It would have been better if you had not gone there.,Bora usingekwenda hapo.
How are things?,Habari gani?
How are things?,Habari?
They come from Sweden.,Wanatoka Uswidi.
You are children.,Nyinyi ni watoto.
Why are you drinking water?,Mbona unanywa maji?
He is responsible for it.,Ni kazi yake.
She is responsible for it.,Ni kazi yake.
What is this thing used for?,Kazi yake nini kitu hiki?
I have succeeded in doing it.,Nimepata kufanya.
I have done it.,Nimepata kufanya.
Colorless green ideas sleep furiously.,Mawazo ya kijani yasiyokamili yanalala hoi.
It's a pretty house.,Ni nyumba nzuri.
My pen is new.,Kalamu changu ni mpya.
Is there a washing machine in the house?,"Je, kuna mashine ya kufulia nyumbani?"
Do you know this lady?,"Je, unajua mwanamke huyu?"
Who is this man?,Mtu huyu ni nani?
"Yes, I am married.","Ndiyo, ninaolewa."
I come from Colombia.,Ninatoka Kolombia.
Do the children go to school?,Watoto wanakwenda shuleni?
"If you don't understand, ask.","Usipofahamu, uliza."
The man is eating bread.,Mwanamume anakula mkate.
Who is reading?,Nani anasoma?
It's a new book.,Ni kitabu kipya.
The boy has a newspaper.,Mvulana ana gazeti.
Is there any reason for that?,"Je, kuna sababu yoyote?"
"Why is this so, Yusufu?","Kwa nini mambo yanakuwa hivi, Bwana Yusufu?"
"Yes, there are two important reasons.","Ndiyo, kuna sababu kubwa mbili."
"In the first place, women have more free time than men. In the second place, they have fewer things to worry about than men.","Kwanza, wanawake wana wakati mwingi zaidi kuliko wanaume. Pili, wanawake wanafikiri mambo machache zaidi kuliko wanaume."
The men go to work.,Wanaume wakakwenda kazini.
The men are generally tired when they come back from work.,Wanaume huchoka wakirudi kutoka kazini.
"Sometimes they say, ""I can't go to school today. I'll go tomorrow.""","Pengine husema, ""Mimi leo siwezi kwenda shuleni. Nitakwenda kesho."""
"In that case, they fall behind.",Kumbe wanachelewa!
I've heard that you don't eat green leafy vegetables. You say that it is food for animals.,Nimesikia kuwa hamli mboga za majani kwenu. Mnasema kuwa ni chakula cha wanyama.
That's nothing but a lie!,Huo ni uongo mtupu.
The people there are not so dumb.,Kule watu wanaelewa.
"They know what ""vitamin"" means.",Wanajua maana ya vitamin ni nini.
"When you don't eat leafy foods, you can't get vitamins.",Usipokula chakula cha majani huwezi kupata vitamin.
I was quite surprised.,Mimi nilistaajabu sana.
I was surprised that when I heard that people really don't eat leafy vegetables.,Nilistaajabu niliposikia kuwa kweli watu hawali mboga za majani.
That's not true at all.,Hiyo si kweli hata kidogo.
"I see that the time is approaching, Yusufu.","Bwana Yusufu, sasa naona wakati unakaribia."
I must hurry to catch the train.,Sina budi nikimbilie gari la moshi.
Fine. I'd be very happy if you would drop me a line as soon as you get to Mwanza.,Vema. Ningefurahi sana kama ungeniandikia barua mara tu ufikapo Mwanza.
Tell me all about the trip you've made.,Unieleze habari zote za safari uliyosafiri.
Tell me how you will take the steamer from Mwanza to Bukoba.,Unieleze jinsi utakavyopanda stima kutoka pale Mwanza mpaka Bukoba.
"Good bye, and safe trip.",Kwaheri bwana. Safiri salama!
"Good bye, and thanks.","Kwaheri bwana, asante!"
You'll see it for yourself.,Wewe mwenyewe utashuhudia.
Ask God that you may visit that country some day.,Omba Mungu uitembelee nchi hiyo siku moja.
"""Father, why are you putting on clean clothes?"" ""Because I'm going to church.""","""Baba, kwa nini unavaa nguo safi?"" ""Kwa sababu ninakwenda kanisani."""
"""Do you want to go to church with me, Daudi?"" ""No, father. I don't want to today. I'll go by myself tomorrow.""","""Daudi, unataka twende kanisani?"" ""Hapana, baba. Sitaki leo. Nitakwenda kesho peke yangu."""
But your mother is going too.,Lakini mama yako anakwenda pia.
"Even if I'm going to stay at home by myself, I'm not going any place at all today.","Ijapokuwa nitakaa nyumbani peke yangu, sitakwenda mahali popote siku ya leo."
I do not want any bananas at all.,Sitaki ndizi zozote.
I do not want any milk at all.,Sitaki maziwa yoyote.
I do not want anybody at all.,Sitaki watu wo wote.
We did not see a single game.,Hatukuona michezo yo yote.
We did not see any children at all.,Hatukuona watoto wo wote.
He does not have any relatives at all.,Yeye hana jamaa ye yote.
He does not have any friends.,Yeye hana rafiki ye yote.
"""I shall go to the market this afternoon. How about you?"" ""No, I will not go.""","""Nitakwenda sokoni mchana. Na wewe je?"" ""La, mimi sitakwenda."""
"""I shall buy a new house. How about you?"" ""No, I will not buy one.""","""Nitanunua nyumba mpya. Na wewe je?"" ""La, mimi sitanunua."""
"""Juma will pay school fees. How about Hamisi?"" ""No, he will not pay them.""","""Juma atalipa ada ya shule. Na Hamisi je?"" ""La, yeye hatalipa."""
"""Juma will help his friends. How about Hamisi?"" ""No, he will not help them.""","""Juma atawasaidia rafiki zake. Na Hamisi je?"" ""La, yeye hatawasaidia."""
"""My friends will learn Nyamwezi. How about yours?"" ""No, they will not learn it.""","""Rafiki zangu watajifunza Kinyamwezi. Na wako je?"" ""La, wao hawatajifunza."""
"""Will you go to the market with Juma?"" ""No, I shall go alone.""","""Utakwenda sokoni na Juma?"" ""La. Nitakwenda peke yangu."""
"""Will Juma go to the market with Hasani?"" ""No, he will go alone.""","""Juma atakwenda sokoni na Hasani?"" ""La. Atakwenda peke yake."""
"""Will the children stay at home with their mother?"" ""No, they will stay alone.""","""Watoto watakaa nyumbani na mama yao?"" ""La. Watakaa peke yao."""
"""Will the porters come with their master?"" ""No, they will come alone.""","""Wachukuzi watakuja na bwana wao?"" ""La. Watakuja peke yao."""
"""Do you want this orange?"" ""No, I don't want any orange at all.""","""Wataka chungwa hili?"" ""Hapana, sitaki chungwa lo lote."""
The boy is eating bread.,Mvulana anakula mkate.
He comes from Genoa.,Anatoka Genova.
He comes from Geneva.,Anatoka Geneva.
Fight for your right.,Kupigana kwa haki yako.
Magdalena and Ania are good friends.,Magdalena na Ania ni marafiki wazuri
The cat is eating.,Paka anakula.
"If I had known, I would not have come.","Kama ningejua, nisingekuja."
Could you say that again?,Utaweza kurudia ulichosema?
Do you know this song?,"Je, unajua wimbo huu?"
You're pretty.,Wewe ni mzuri.
My name is John.,Jina langu ni John.
That's a tree.,Ule ni mti.
See you tomorrow!,Tutaonana kesho!
I'm not an idiot.,Mimi si mjinga.
They are not coming today.,Hawaji leo.
I've lost my keys.,Nimepoteza funguo zangu.
Where do you know each other from?,Mnajuana kutoka wapi?
You are a student.,Wewe ni mwanafunzi.
I can't sleep.,Siwezi kulala.
I'm from England.,Natoka Uingereza.
He comes from Wales.,Anatoka Welisi.
I came yesterday.,Nilikuja jana.
I look forward to it.,Natazamia.
Where are we now?,Tuko wapi sasa?
Listen.,Sikiliza.
I want to go.,Nataka kwenda.
They're bad.,Wao ni wabaya.
I come from America.,Ninatoka Amerika.
They're children.,Wao ni watoto.
I can walk.,Ninaweza kutembea.
I'll save you.,Nitakuokoa.
I didn't take anything.,Sikuchukua chochote.
I come from Boston.,Ninatoka Boston.
Do you want my heart between your teeth?,Unataka moyo wangu kati ya meno yako?
Is your mum at home?,Mamako yupo nyumbani?
I know it was strange.,Ninajua kuwa alikuwa wa ajabu.
I must tell you something.,Yanipasa kukuambia kitu.
I have a cat.,Nina paka.
I have two cats.,Nina paka wawili.
Do not drink the water in the dirty glass!,Usinywe maji yaliyo bilaurini!
A promise is a debt.,Ahadi ni deni.
I ate the meat.,Nilikula nyama.
I'm not a doctor.,Mimi si daktari.
I'm a woman.,Mimi ni mwanamke.
Children are the flowers of our lives.,Watoto ni maua ya maisha yetu.
She is a singer.,Yeye ni mwimbaji.
I wrote a book about China.,Niliandika kitabu kuhusu China.
What's your nationality?,Nini uraia wako?
It's three o'clock.,Ni saa tisa.
Jorge speaks four languages.,Jorge azungumza lugha nne.
Do you remember her name?,"Je, unakumbuka jina lake?"
I can speak your language.,Naweza kuzungumza lugha yako.
I found one.,Nilipata moja.
Mary knows me.,Mary ananijua.
Emily wrote the sentence.,Emily aliandika sentensi.
I hate maths.,Ninachukia hesabu.
I'm drinking water in the kitchen.,Nanywa maji jikoni.
I'm not a fangirl.,Mimi si msichana wa shabiki.
You broke the table you were sitting on.,Ulivunja meza uliyekuwa ukikaa.
Don't smoke in bed.,Usivute sigara kitandani.
How are you this morning?,Habari za asubuhi?
Please bring me eggs.,"Tafadhali, niletee mayai."
Do you want food?,"Je, unataka chakula?"
Do you want eggs?,"Je, unataka mayai?"
Do you want fruit?,"Je, unataka matunda?"
Do you want fruit?,Unataka matunda?
Please bring me fruit.,"Tafadhali, niletee matunda."
Please bring me porridge.,"Tafadhali, niletee uji."
What kind of food is there?,Kuna chakula gani?
There is gruel.,Kuna uji.
Do you want gruel?,"Je, unataka uji?"
"Yes, bring me gruel.",Ndiyo. Niletee uji.
There is fruit.,Kuna matunda.
Would you like some fruit?,"Je, unataka matunda?"
Are there any bananas?,Kuna ndizi?
He's been drinking beer.,Yeye amekwisha kunywa pombe.
I go on foot.,Naenda kwa miguu.
Melanie likes music.,Melanie anapenda muziki.
She is my teacher.,Yeye ni mwalimu wangu.
The man is strong.,Mtu ni mwenye nguvu.
I'm not listening to music.,Sisikilizi muziki.
My book is here.,Kitabu changu ni hapa.
A monarch had six sons.,Mtawala alikuwa na wana wasita.
I'm cooking.,Ninapika.
You're cooking.,Unapika.
She's cooking.,Anapika.
They're reading a book.,Wanasoma kitabu.
You're reading.,Unasoma.
He's reading.,Anasoma.
They're writing.,Wanaandika.
We're writing.,Tunaandika.
You're writing.,Mnaandika.
You're writing.,Unaandika.
She's cooking now.,Anapika sasa.
We're cooking now.,Tunapika sasa.
I'm eating a sandwich.,Ninakula sandwichi.
The horse is black.,Farasi ni mweusi.
Do you eat fish?,"Je, unakula samaki?"
I want to drink tea.,Ninataka kunywa chai.
The horse is not white.,Farasi si mweupe.
This horse is white.,Farasi hii ni mweupe.
This horse is not white.,Farasi hii si mweupe.
She's a doctor.,Yeye ni daktari.
She's a good woman.,Yeye ni mwanamke mzuri.
Their car is not good.,Gari yao si jizuri.
She is a good student.,Yeye ni mwanafunzi mzuri.
You're not a man.,Wewe si mtu.
You're not a woman.,Wewe si mwanamke.
I went to the bank.,Nilikwenda benki.
My wife went to the farm.,Mke wangu alikwenda shamba.
His money is in the bank.,Fedha zake ni katika benki.
It surprises me.,Ananishangaza.
The girls work.,Wasichana wanafanya kazi.
Pua sang at church.,Pua aliimba kanisani.
Pua is singing at church.,Pua anaimba kanisani.
I finished writing.,Nilimaliza kuandika.
He is inside this house.,Yeye ni ndani ya nyumba hii.
The birds are red.,Ndege ni mwekundu.
The stone is heavy.,Jiwe ni zito.
Are you anxious?,"Je, una wasiwasi?"
The man wants to know the truth.,Mtu anataka kujua ukweli.
The woman wants to know the truth.,Mwanamke anataka kujua ukweli.
The boy wants to know the truth.,Mvulana anataka kujua ukweli.
The girl wants to know the truth.,Msichana anataka kujua ukweli.
Nobody knows the truth.,Hakuna anayejua ukweli.
Melanie is not a fortune teller.,Melanie si mpigaramli.
Millie is drinking water.,Millie ananywa maji.
Millie isn't drinking water.,Millie hanywi maji.
It was the truth.,Ulikuwa ukweli.
You can tell the truth.,Unaweza kusema ukweli.
You can't go there.,Huwezi kwenda huko.
Millie loves chocolate.,Millie anapenda chokoleti.
Millie will tell us the truth.,Millie atatusema ukweli.
Millie is very cute.,Millie ni mzuri sana.
"I love you, Millie!","Ninakupenda, Millie!"
Millie has beautiful eyes.,Millie ana macho mazuri.
Millie has green eyes.,Millie ana macho ya kijani.
Millie has blue eyes.,Millie ana macho ya bluu.
She'll pass the exam for sure.,Atapita mtihani kwa hakika.
Millie is learning Swahili.,Millie anajifunza Kiswahili.
Millie is hungry.,Millie ana njaa.
Millie loves him.,Millie anampenda.
Millie is going to school.,Millie anakwenda shule.
Millie loves me.,Millie ananipenda.
Millie has a cat.,Millie ana paka.
Millie has a dog.,Millie ana mbwa.
Millie is eating bread.,Millie anakula mkate.
Millie is listening to music.,Millie anasikiliza muziki.
Millie is eating a banana.,Millie anakula ndizi.
Millie has a book.,Millie ana kitabu.
Millie is reading her book.,Millie anasoma kitabu chake.
I'm reading my book.,Ninasoma kitabu changu.
I'm going on a trip.,Ninaenda katika safari.
Millie is eating an apple.,Millie anakula tufaha.
Millie isn't eating an apple.,Millie hali tufaha.
I like your body.,Ninapenda mwili wako.
You don't have brown eyes.,Huna macho ya kahawia.
He doesn't have a gun.,Yeye hana bunduki.
Does she have a new computer?,"Je, ana kompyuta npya?"
The girl has a white horse.,Msichana ana farasi nyeupe.
She has red flowers.,Ana maua mekundu.
The boy has a horse.,Mvulana ana farasi.
We didn't come.,Hatukuja.
The book isn't new.,Kitabu si kipya.
Your cat is black.,Paka wako ni mweusi.
I have a Twitter account.,Nina akaunti ya Twitter.
My brother has a Twitter account.,Ndugu yangu ana akaunti ya Twitter.
I want to go fishing.,Ninataka kwenda uvuvi.
The library is to the right.,Maktaba ni upande wa kulia.
The library is to the left.,Maktaba ni upande wa kushoto.
I will say.,Nitasema.
She attacked the enemy.,Alishambulia adui.
I can read.,Ninaweza kusoma.
There are students in the library.,Kuna wanafunzi maktabani.
What can we drink?,Tunaweza kunywa nini?
I don't want to go to the bank.,Sitaki kwenda benki.
The students sit at the desk.,Wanafunzi wanakaa mezani.
I'm Tibetan.,Mimi ni Mtibeti.
I'm not Tibetan.,Mimi si Mtibeti.
That was a very sad story.,Hiyo ilikuwa hadithi ya kusikitika sana.
Hamisi uses sugar.,Hamisi anatumia sukari.
Hamisi wants sugar.,Hamisi anataka sukari.
My friend wants sugar.,Rafiki yangu anataka sukari.
My friend wants milk.,Rafiki yangu anataka maziwa.
My friend uses sugar.,Rafiki yangu anatumia sukari.
Hamisi doesn't want sugar.,Hamisi hapendi sukari.
Hamisi doesn't use sugar.,Hamisi hatumii sukari.
Hamisi doesn't use milk.,Hamisi hatumii maziwa.
My friend doesn't use milk.,Rafiki yangu hatumii maziwa.
My friend doesn't use sugar.,Rafiki yangu hatumii sukari.
My friend doesn't want sugar.,Rafiki yangu hapendi sukari.
The children use sugar.,Watoto wanatumia sukari.
There is not enough bread.,Mkate hautoshi.
There is not enough milk.,Maziwa hayatoshi.
There is not enough fruit.,Matunda hayatoshi.
There are not enough oranges.,Machungwa hayatoshi.
There are not enough mangoes.,Maembe hayatoshi.
There are not enough mangoes.,Embe hazitoshi.
There's not enough food.,Chakula hakitoshi.
There is not enough butter.,Siagi haitoshi.
There is not enough meat.,Nyama haitoshi.
There is not enough tea.,Chai haitoshi.
There is not enough coffee.,Kahawa haitoshi.
There is not enough gruel.,Uji hautoshi.
There are not enough bananas.,Ndizi hazitoshi.
I want to be an actress.,Ninataka kuwa mchezaji.
He is not a child.,Yeye si mtoto.
Give me fire.,Nipe moto.
He brought me coffee.,Alinileta kahawa.
It is Anita's house.,Ni nyumba ya Anita.
This is my third week.,Hii ni wiki yangu ya tatu.
She's boiling eggs in the kitchen.,Anachemka mayai jikoni.
I sleep naked.,Nalala uchi.
There are islands in the sea.,Kuna visiwa katika bahari.
The fish can swim.,Samaki anaweza kuogelea.
There are a lot of big cities in Brazil.,Kuna miji mingi mikubwa katika Brazil.
"The Russian language is a Slavic language spoken natively in Russia, Belarus, Ukraine, Kazakhstan and Kyrgyzstan, and is widely used, although without official imprimatur, in Latvia, Estonia and many other countries that form the constituent republics of the former Soviet Union.","Lugha ya kirusi ni lugha ya kislavoni inayoongelewa kama lugha ya asili huko Urusi, Belarusi, Ukraine, Kazakhstan na Kyrgyzstan, na pia inatumika sana, ijapokuwa si kama lugha rasmi huko Latvia, Estonia na nchi nyingine nyingi zilizokuwa ni jamhuri katika Umoja wa Sovieti wa zamani."
It's not that simple.,Si rahisi hivyo.
Burj Khalifa is currently the tallest skyscraper in the world.,"Kwa sasa, Burj Khalifa ni jengo refu zaidi duniani."
I'm in the kitchen.,Nipo jikoni.
Where is Mary?,Mary yuko wapi?
Where is Tom?,Tom yuko wapi?
Where's Tom?,Tom yuko wapi?
Look at that photo.,Tizama hii picha.
This is my cat.,Hii paka ni yangu.
The boy is jumping.,Mvulana anaruka.
The horse is jumping.,Farasi anaruka.
What's your name?,Jina lako ni nani?
"Hello, what's your name?","Jambo, jina lako ni nani?"
I don't understand you.,Sikuelewi.
I don't understand.,Sielewi.
I drink water.,Nanywa maji.
Where are the books?,Vitabu viko wapi?
It doesn't matter.,Sawa.
No worries.,Hakuna matata.
All of these sentences need a full stop.,Sentensi hizi zote zinahitaji kikomo.
I don't know you.,Sikujui.
I want bread.,Ninataka mkate.
Tláloc likes to travel.,Tlaloc anapenda kusafiri.
Tláloc likes travelling.,Tlaloc anapenda kusafiri.
Water is life.,Maji ni uhai.
Languages have hard words.,Lugha zina maneno magumu.
"If he had had time, he would have gone.",Angalikuwa na nafasi angalikwenda.
I ate eggs yesterday.,Nilikula mayai jana.
My children live in New York.,Watoto wangu wanaishi katika New York.
For how long will you stay?,Utakaa muda ghani?
"If I don't eat, I will die.",Nisipokula nitakufa.
We didn't see any children at all.,Hatukuona watoto wo wote.
We didn't see a single game.,Hatukuona michezo yo yote.
What's this thing used for?,Kazi yake nini kitu hiki?
Hi!,Jambo!
Good question.,Swali nzuri.
I have a question.,Nina swali.
I felt ill.,Nilijisikia vibaya.
I felt bad.,Nilijisikia vibaya.
He is a good student.,Yeye ni mwanafunzi mzuri.
I don't know what to say...,Sijui niambie nini...
Elephants eat grass.,Tembo wanakula nyasi.
"If you don't understand, ask.","Usipoelewa, uliza."
"If you do not understand, ask.","Usipoelewa, uliza."
It's not important.,Si ya maana.
It's not important.,Si muhimu.
It isn't important.,Si muhimu.
Languages have difficult words.,Lugha zina maneno magumu.
Stay home.,Kaa nyumbani.
Why!,Kwa nini!?
"Alright, OK.","Sawa, sawa"
Happy New Year!,Heri ya mwaka mpya!
Millie doesn't drink water.,Millie hanywi maji.
We want complete sentences.,Tunataka misemwa inayoenea.
I'm French and she's American.,Mimi ni Mfaransa na yeye ni Mamerika.
I am French and she is American.,Mimi ni Mfaransa na yeye ni Mamerika.
I'm French and he's American.,Mimi ni Mfaransa na yeye ni Mamerika.
I am French and he is American.,Mimi ni Mfaransa na yeye ni Mamerika.
Who's she?,Yeye ni nani?
Who is she?,Yeye ni nani?
The tank is empty.,Tangi ni tupu.
The tank is full.,Tangi limejaa.
What is my room number?,Chumba changu ni namba ngapi?
There was nobody.,Hapakuwa na mtu.
You must go home.,Lazima uende nyumbani.
Tom is a teacher.,Tom ni mwalimu.
Tom is at school.,Tom yuko shuleni.
Tom was at school.,Tom alikuwa shuleni.
There's no reason to be afraid.,Hakuna sababu ya kuogopa.
What is the price?,Bei gani?
I'm ready.,Nimemaliza.
The car is out of order.,Gari limeharibika.
How much must I pay?,Nilipe kiasi gani?
When will we arrive?,Tutafika lini?
Go straight ahead.,Nenda moja kwa moja.
Please close the window.,Tafadhali funga dirisha.
I'm thirty now.,Niko na miaka thelathini sasa.
"Good morning, people!",Habari za asubuhi watu!
She needs help.,Anahitaji msaada.
I'm happy.,Ninafurahi.
I'm not happy.,Sifurahi.
I know that I know.,Najua kwamba najua.
I don't want any bananas at all.,Sitaki ndizi zozote.
What's my room number?,Chumba changu ni namba ngapi?
I don't want any milk at all.,Sitaki maziwa yoyote.
I don't want anybody at all.,Sitaki watu wo wote.
I've had enough of your anti-science poverty.,Nimetosha na umaskini wako wa kupinga sayansi.
You wanted to tell me about freedom?,Ulitaka kunieleza kuhusu uhuru?
I started learning Chinese last week.,Nilianza kujifunza Kichina juma lililopita.
You are a good student.,Wewe ni mwanafunzu mzuri.
You have to turn in the reports on Monday.,Lazima uwasilishe ripoti Jumatatu.
What do you intend to do?,Unanua kufanya nini?
Where are you from in Canada?,Unatoka wapi huko Kanada?
"You always like to trip me up, don't you?","Unapenda kunifanyia mzaha, sio?"
Prices are high these days.,Bei ziko juu mno siku hizi.
The bridge is open to traffic.,Daraja liko wazi kwa trafiki.
"Fish, please.","Samaki, tafadhali"
You'll miss the train if you don't hurry.,Utaachwa na garimoshi usipoharakisha.
Discussion is based upon mutual respect.,Majadiliano yanategemea kustahiana.
"In the days of the knights, they wore shields to protect themselves from sword-fight wounds.","Katika siku za vita, walivaa ngao kujilinda na majeraha ya mapanga."
We can say that Japan was fighting a constant battle against hunger during the war.,Tunaweza kusema kuwa Japan ilikuwa ikipigana vita vya mara kwa mara dhidi ya njaa wakati wa vita.
"If the quality of your product meets with our customer's approval, we will place regular orders.","Ikiwa ubora wa bidhaa yako inafurahisha wateja wetu, tutaweka maagizo ya kila mara."
"During the press conference, the President touched on foreign relations.","Wakati wa mkutano na waandishi wa habari, Rais alizungumza kuhusu uhusiano wa nje."
"A whistle blew, and the boat slowly began to pull out of port.","Filimbi ililia, na mashua ikaanza polepole kutoka bandarini."
I met Naomi on my way home and we had a chat.,Nilikutana na Naomi nilipokuwa nikirudi nyumbani na tukawa na mazungumzo.
"After having fought many hard battles, we were able to bring home the bacon and set up a new government.","Baada ya kupigana vita vingi ngumu, tuliweza kuleta matekeo ya maana na kuanzisha serikali mpya."
"Strange to say, he didn't know the news.","Ni ajabu kusema, hakuwa anajua taarifa."
Billy often hits his face against windows.,Mara nyingi Billy hugonga uso wake madirishani.
If it becomes stubborn indeed it stands alone.,Ikiwa inakuwa mkaidi kweli inasimama peke yake.
The audience was excited at the game.,Hadhira walifurahia mchezo.
He left his team as he could not get along with the manager.,Aliacha timu yake kwa kuwa hakuelewana na meneja.
Shouts of joy burst forth.,Shangwe na nderemo zilisikika.
I beat him completely in the debate.,Nilimshinda kabisa kwenye mjadala.
You have our permission to include our software on condition that you send us a copy of the final product.,Una ruhusa yetu kujumuisha programu yetu kwa sharti kwamba ututumie nakala ya bidhaa ya mwisho.
An old oak is groaning in the storm.,Mwaloni mzee anaguruma katika dhoruba.
My forehead burned with fever.,Kisogo changu kiliungua kwa joto kali.
I graduated from the school.,Nilihitimu kutoka shule.
Remember to post the letter on your way to school.,Kumbuka kutuma barua unapoelekea shule.
This was third school shooting incident in six months.,Hili lilikuwa tukio la tatu laq ufiatuaji risasi katika shule ndani ya miezi sita.
